{"question":"对于一年期的课程，学生最多允许缺勤多少次？","answer":"对于一年期的课程，学生最多只能缺勤 21 次。","contexts":["1.  缺勤总次数上限（有理由和/或无理由）\n布鲁克莱恩高中希望学生正常上课和出勤。学校课业学分包括作业评级和\n学习社区参与度。对一年期的课程，学生最多只能缺勤 21 次（占每个课\n程 140 以上天数的 15%），一学期的课程最多缺勤 11 次，两天/周的学期\n课程最多缺勤 6 次。任何缺勤总次数超过该上线的课程将没有学分。达不\n到上述出勤标准的学生，其成绩单上的最终评级将为“N”。","d.  第 10 次无故擅自缺勤（AWOLs）：课程的期末成绩为“N”。学生\n无上诉权。\ne.  由 3 次无故缺勤导致期末成绩为“N”的学期课程，可以视出勤改进\n计划和学生上诉情况最终确定。第 5 次无故缺勤之后，学生无上诉权\n利。","a.\n首次及其后的无故擅自缺勤（AWOLs）：教师告知学生，无理由缺\n席当天学生所得的作业分数最多不超过总分的一半，包括大小测验的\n成绩。\nb.   1 次以上、5 次以下无故擅自缺勤（AWOLs）：教师和院长按纪律条\n例视情节给予学生处分，其中可能包括与家长沟通，课后留堂，禁止\n进入 X 活动区（X-block），直至停学和留级。","7.  弥补措施\n学生如果某门课得了“N”，在某些情况下，可以通过暑假学校补课，前提\n是学生累计缺勤不超过 35 次(总课时的 25%，非满学期的课程按照学分折\n算)。缺勤超过总课时 25%之后，学生没有资格参加暑期学校“补回”该课\n程的学分。学生在这种情况下只有参加暑期学校完整修读该课程的全部原定\n学分，或在下一年重新修读这门课程。(请注意：BHS 暑期学校不开设“全\n部原定学分”的英语课程。）\n8.   上诉\n如果一个学生成功履行了其出勤改进计划，学生可通过院长请求校长考虑删","4.   无理由缺勤（无故擅自缺勤，AWOLs）\n布鲁克莱恩高中要求学生所有课程一律出勤。以下列出了一年期课程无理由\n缺勤的处罚；如一学期课程或半学分课程无理由缺勤总数占到一定比例，也\n适用于下述规定。"],"ground_truth":""}
{"question":"SMARTS 制度中的字母 “M” 和 “S(最后一个)” 分别代表什么意思？","answer":"M 代表 Moral，S 代表 Safety。","contexts":["[--- 以下为文件第 18 页内容 ---]\n规章 1.4：个人电子设备使用制度\n布鲁克莱恩高中认识到了当今世界科技的广泛应用。然而我们的校园文化建设\n同时也高度重视人际互动，重视现实生活中人与人之间的密切往来。考虑到这两方\n面的现实情况，我们主张 SMARTS 制度：","各系在每学年伊始都在特殊纪律中说明作弊和抄袭问题。新生将会由一名管理\n人员当面告知相关事项，确保学生理解相关制度。最后，国际学生辅导员将与学\n生、教师、管理员合作，向来自不同文化的学生解释这些内容。","a.  所有缺勤，无论有无理由，都将记入缺勤总次数上限。以下情况除                                                                                                                                                 \n                                        外：宗教节日、马萨诸塞州综合评估系统测试（MCAS）、大学先","规章 2.2：枪支武器零容忍政策\n禁止携带任何枪支进入学校建筑物内或校园其他地方\n《马塞诸塞州普通法》第 269 章第 10 节规定：\n（j）“任何非执法人员，即使其获得第                                     140  章（见下文）规定的持枪\n牌照，若将枪支（见下文定义）携带进任何初高中或大学校园的教学楼\n和活动场地，无论枪支有无弹药，携带者均将被处于                                                 1000   美元以下的\n罚款（$1,000）或一年以下的拘留，亦或两罚并处。在本条款中，“枪\n支”包括任何能够发射子弹的普通手枪、左轮手枪、步枪和滑膛枪等。\n第 150 章第 2 节，St.1989 修正。”","[--- 以下为文件第 10 页内容 ---]\n\n修课程考试（A.P.              exams）、特殊教育考试和会议、前往中国交换                                                                                                                               \n                                        学习或停学等。"],"ground_truth":""}
{"question":"学校规定的“含酒精饮料”的标准是什么？","answer":"华氏60°时酒精含量达到或超过1.5%的、适用于人类消费的液体。","contexts":["[--- 以下为文件第 13 页内容 ---]\n规章 1.2：校内或学校举办的活动场所实施毒品及饮酒零容忍政策\n布鲁克莱恩学校认为未成年人拥有和/或使用非法药品/毒品、非法拥有和/或饮\n用酒精饮料，将会严重损害学生的身体和/或情绪状态。因此，布鲁克莱恩高中制\n定了严格的规章，在校内或在学校举办的活动，包括运动会以及非教学日的校外\n社会活动，禁止拥有、出售、转让或使用以上物品。","法律定义\n\n“含酒精饮料”：华氏                      60°时酒精含量达到或超过                       1.5%的、适用于人类消费的液                                                                                                             \n                      体。G.L.c.138，S.1\n\n“管控物品”：G.L.c.94C                   定义的一切管控物品或药品。","A.藏有：教工或学生如有可据理由怀疑学生藏有毒品或酒精应向学校管理人员报\n告。学生管理人员将就此展开调查，并可以请求警方参与；适当情况下，应采取以\n下步骤：\n违禁 #1：通知学生父母或监护人，举行校纪聆讯，处以学生至少五天停学\n处罚。学生须接受强制的毒品教育和咨询辅导。学生还可能被剥夺参与学\n校课外活动的权利，禁止进入校园，甚至被校长开除学籍。","[--- 以下为文件第 23 页内容 ---]\n豪：尊重每个人已成为我校的标志性理念。对于言语骚扰行为，学校始终给予高度\n重视；对于任何违反“尊重爱人”校园文化理念的学生，学校均会给予严厉处罚。\n依据新欺凌法，学校需要制定制止校园欺凌行为的正式方案。在本区教育官员的带\n领下，我们学校以及布鲁克莱恩其他公立学校根据《关于校园欺凌行为的法案》的\n规定，共同制定了相关方案。这期间，我校以海报形式对州法律规定的欺凌行为进\n行了普法宣传，并介绍了我校近来惩治欺凌行为的措施和进展。","规章 2.2：枪支武器零容忍政策\n禁止携带任何枪支进入学校建筑物内或校园其他地方\n《马塞诸塞州普通法》第 269 章第 10 节规定：\n（j）“任何非执法人员，即使其获得第                                     140  章（见下文）规定的持枪\n牌照，若将枪支（见下文定义）携带进任何初高中或大学校园的教学楼\n和活动场地，无论枪支有无弹药，携带者均将被处于                                                 1000   美元以下的\n罚款（$1,000）或一年以下的拘留，亦或两罚并处。在本条款中，“枪\n支”包括任何能够发射子弹的普通手枪、左轮手枪、步枪和滑膛枪等。\n第 150 章第 2 节，St.1989 修正。”"],"ground_truth":""}
{"question":"如果学生被发现在校园内吸烟，第一次和第二次被发现分别会受到什么具体处罚？","answer":"第一次是正常上课时间内使用任何类型的烟草制品均属于违法行为。另外，严禁任何人，在校园建筑、学校设施、学校场地和校车内使用任何烟草制品。\n\n第二次再犯：停学 3 天并执行违禁#1 的所有处罚措施。","contexts":["违禁 #1：通知学生家长或监护人，并让他们安排把学生从护士办公室带回\n家。学生必须有人监看，直至学生进入管理人员、家长/监护人的会谈现\n场。举行校纪聆讯，学生将被处以停学至少三天的处罚。学生须接受强制\n毒品教育和咨询辅导。学生还可能被剥夺参与学校课外活动的权利，禁止进\n入校园，甚至被校长开除学籍。","i.  马萨诸塞州普通法第 71 章第 37H½节规定：学生如在学校宿舍、学校活动\n或与学校有关的活动（包括竞技游戏）中被发现携带危险武器（包括但不\n仅限于枪支或刀具）或第                         94  章    C  规定的管制物品（包括但不仅限于大\n麻、可卡因、海洛因等），可能被校长开除出学校或学区。学生如在学校\n宿舍、学校活动或与学校有关的活动（包括竞技游戏）中攻击校长、副校\n长、教师、教师助理或其他教学员工，可能会被校长开除出学校或学区。\n任何被控诉违反(a)或(b)条款的学生会收到一份参加聆讯的书面通知；假\n如该学生准备了自我陈述，该生可在上述聆讯现场向校长出示证据和证\n人。","•    违禁     #2（及后续违规行为）：学生将被要求参加药物滥用预防教育的\n烟草教育课程（TEP）。烟草教育课程含有一次学生和家长的教育与评\n估会。父母可以选择让孩子参加额外课程，并将获得额外资源的信息。","规章 1.5：禁烟制度\n马萨诸塞州所有中小学生，在正常上课时间内使用任何类型的烟草制品均属于\n违法行为。另外，严禁任何人，包括学校工作人员，在校园建筑、学校设施、学校\n场地和校车内使用任何烟草制品，详见：马萨诸塞州普通法 71 章 2A 款；马萨诸\n塞州普通法 71 章 37H 款；布鲁克莱恩公学规章制度手册，G(1)(c)款。","再犯：停学 3 天并执行违禁#1 的所有处罚措施。\n《马塞诸塞州欺凌法案》：\n2010 年 5 月 3 日，马萨诸塞州州长迪沃·帕特里克签署了《马塞诸塞州普通\n法》第 71 章第 370 条法案《关于校园欺凌行为的法案》。该法要求各校区制定并\n实施制止校园欺凌行为的办法。在布鲁克莱恩高中，为确保每位学生和教职人员的\n安全，我们始终致力于建设和谐安全的校园环境；我们也为自己取得的成绩感到自"],"ground_truth":""}
{"question":"发生哪些事件时，学校的授权报告机构必须立即向警方报告？请列举至少三项。","answer":"学校财产范围内；学校财产 1000 英尺半径范围内；学校资助的活动上；学校所有或学校合同签有的交通工具内。","contexts":["下列授权报告事件发生时，授权报告机构将立即向指定的联络警方报告：\n    学校财产范围内\n    学校财产 1000 英尺半径范围内\n    学校资助的活动上\n    学校所有或学校合同签有的交通工具内","A.藏有：教工或学生如有可据理由怀疑学生藏有毒品或酒精应向学校管理人员报\n告。学生管理人员将就此展开调查，并可以请求警方参与；适当情况下，应采取以\n下步骤：\n违禁 #1：通知学生父母或监护人，举行校纪聆讯，处以学生至少五天停学\n处罚。学生须接受强制的毒品教育和咨询辅导。学生还可能被剥夺参与学\n校课外活动的权利，禁止进入校园，甚至被校长开除学籍。","    任何涉及或涉嫌犯下仇恨罪行或侵犯公民权利的事件\n    任何纵火事件或威胁，或涉及燃烧装置或爆炸物的事件\n\n所有员工都将遵守学校的建筑设施范围内标准应对措施方案，及时报告上述事                                                                                                                                                        \n                      件。","违禁 #1：管理人员召集家长或监护人，并给予警告，同时将违规行为\n按照严重程度分为“A”“B”“C”和“F”四等，然后决定是否需要\n警方立即介入。\n违禁 #2：管理人员举行由涉事学生及家长或监护人参加的校纪聆讯，\n如果事出有因，要求涉事学生就所犯违禁事项撰写研究报告或其他研究\n性质的书面作业；此种作业如未能按时完成，学生将立即被处以两天的\n停学处罚。必要时可要求学生参加相关行为的咨询辅导。","修正。”\n武器是指任何可以造成人身伤害的物品，例如，枪支、木棒、铜环、刀、子\n弹，或工具均属于违禁武器。因此，如果教职工确实亲眼目睹学生携带、出售或转\n让武器，应立即向学校管理人员报告。"],"ground_truth":""}
{"question":"如果一名参加了特殊教育计划（IEP）的学生在一个学年内的累计停学时间达到10天，学校需要遵守什么特定程序？","answer":"根据美国残疾儿童教育法案规定，在 1988 年 Honig v.Doe 的案件中，美国最高法院裁决学生在一个学年的停学时间总数累计如达到或超过十天，则构成更换安置地点的条件。因此，该类停学需要遵守以下程序：\r\n与该生的残疾有关；ii. 属于该生特殊教育计划不当或安置不当的结果；或iii. 属于该生特殊教育计划未得到完全执行的结果\r\n\r\nc. 如复审团队认为该生的行为与上述第 4 节 b 条款所列三个因素中的任一因\r\n素相关，则不可对该生实行一学年累计十天以上的停学处理，且i. 必须对该生的特殊教育计划进行修改，制定出一个更能有效满足该生需求的新计划，或如该生的特殊教育计划是恰当的，但该生的行为是其特教计划未能完全执行的结果，则学校必须采取所有应当采取的措施保证该生的特殊教育计划得到完全执行。","contexts":["b)  如特殊需求学生一个学年内的停学时间累计不超过                                              10  天，则\n根据学校委员会“纪律守则规章”第 A 节第 4 条款和上述第 3\n条规定，该生可立即被实行停学处理。","4.  该生的停学次数及停学时间应记录并保存到该生的特殊教育计划文                                                                                                                                               \n                                          件中，直到下一期特殊教育计划开始执行。\n\n4.   如特殊教育学生一学年里的累积停学时间达到或超过十天，则执行以下政策：","根据美国残疾儿童教育法案规定，在 1988 年 Honig v.Doe 的案件中，美国最高\n法院裁决学生在一个学年的停学时间总数累计如达到或超过十天，则构成更换\n安置地点的条件。[参阅                      Honig v.Doe 108 S.Ct582（1988）]。因此，该类停学\n需要遵守以下程序：","与该生的残疾有关；\nii.\n属于该生特殊教育计划不当或安置不当的结果；或\niii.\n属于该生特殊教育计划未得到完全执行的结果\nc.  如复审团队认为该生的行为与上述第 4 节 b 条款所列三个因素中的任一因\n素相关，则不可对该生实行一学年累计十天以上的停学处理，且\ni.    必须对该生的特殊教育计划进行修改，制定出一个更能有效满足\n该生需求的新计划，或如该生的特殊教育计划是恰当的，但该生\n的行为是其特教计划未能完全执行的结果，则学校必须采取所有\n应当采取的措施保证该生的特殊教育计划得到完全执行。","任何连续停学              10  个上课日以上的学生都有权获得由各校校长制定的全校教育\n服务计划，从而获得教育服务，以期在停学期间也能取得学业进步。停学时间等于\n或少于        10  个上课日的学生也可获得停学期间的教育机会。如无严重违纪行为，学\n校不可对学生处以                  90  个上课日以上的停学处罚。对某些违纪行为，正当程序和诉\n讼需要学生和家长和/或监护人共同参与。学校校长拥有自由裁量权处罚学生的违\n纪行为。"],"ground_truth":""}
{"question":"一名校队运动员如果是第一次违反药品卫生制度，他对后续比赛的参与资格会受到什么具体影响？如果是第二次违规呢？","answer":"第一次违规：该生将失去参加此后系列校际比赛的资格，占该运动校际比赛总场次的25%\n\n第二次及之后的违禁：学生将失去参加此后系列校际比赛的资格，占该运动校际比赛总场次的60%。","contexts":["[--- 以下为文件第 15 页内容 ---]\nMIAA 学生运动员化学药品卫生政策追加处罚：\n1.   首次违禁：运动员主任，或由校长或校长指定负责人召开的校纪聆讯，如果确\n定某一学生存在违禁事实，该生将失去参加此后系列校际比赛的资格，占该运\n动校际比赛总场次的                    25%（见       MIAA 手册，2005 年               7 月    1 日）。任何被医治\n项目收治的学生均不得例外。为辅助康复，建议可以让学生继续保持练习。","2.   第二次及之后的违禁：运动员主任，或由校长或校长指定负责人召开的校纪聆\n讯，如果确定某一学生存在违禁事实，该生将失去参加此后系列校际比赛的资\n格，占该运动校际比赛总场次的 60%。第二次及以上违禁后，学生如自愿加入\n获得学校批准认可的治疗方案，则学生可能有机会在赛事结束 40%之后重新取\n得参赛资格。","违规情况#2：布鲁克莱恩警方报告学生违反药品卫生管理制度后，该生姓\n名将被提交给表演系主任和教职员工。主任和教职员工将采取下列惩处措\n施：涉事学生必须参加注意力转移项目，接受疏导和教育，以使他们能成功\n回归表演系的角色中。此外，学生还将被罚以以下惩处：\n1.)如学生目前正在参加任何课外表演作品的试镜，她/他将失去参加该作品\n下一次演出的资格。","违规情况#1：布鲁克莱恩警方报告学生违反药品卫生管理制度后，该生姓\n名将被提交给表演系主任和教职员工。主任和教职员工将采取下列惩处措\n施：涉事学生必须参加注意力转移项目，接受毒品教育，以使他们能成功回\n归表演系的角色中。此外，学生还将被罚以以下惩处：\n1.)如学生目前正在参加任何课外表演作品的试镜，她/他将失去参加该作品\n下一次演出的资格。","违禁 #1：学生如违反布鲁克莱恩高中药品卫生制度将被转介参加药物滥\n用预防方案接受评估。学生如拒绝配合评估程序，将面临院长主持的校纪\n聆讯，且学生将被禁止参与任何学校举办的课外活动。"],"ground_truth":""}
{"question":"无故缺勤达到第6次和第10次时，学生成绩的处理和上诉权利有什么不同？","answer":"第6次无故缺勤（AWOL），课程成绩判定为“N”。征询教师意见。制定考勤改进计划，如果学生随后达到出勤改进计划的要求，在课程结束时，学生可以就本课程的“N”成绩上诉，且能够得到学校的支持。在考勤改进计划实施期间，之前及其后的无故擅自缺勤记录将累积计算（错误记录除外）。\n\n第10次无故缺勤（AWOL），课程成绩判定为\"N\"。学生无上诉权。","contexts":["d.  第 10 次无故擅自缺勤（AWOLs）：课程的期末成绩为“N”。学生\n无上诉权。\ne.  由 3 次无故缺勤导致期末成绩为“N”的学期课程，可以视出勤改进\n计划和学生上诉情况最终确定。第 5 次无故缺勤之后，学生无上诉权\n利。","[--- 以下为文件第 11 页内容 ---]\nc.  第 6 次无故擅自缺勤（AWOLs）：课程成绩判定为“N”。征询教\n师意见。制定考勤改进计划，如果学生随后达到出勤改进计划的要\n求，在课程结束时，学生可以就本课程的“N”成绩上诉，且能够得\n到学校的支持。在考勤改进计划实施期间，之前及其后的无故擅自缺\n勤记录将累积计算（错误记录除外）。","由 3 次无故缺勤导致期末成绩为“N”的学期课程，可以视出勤改进\n计划和学生上诉情况最终确定。第 5 次无故缺勤之后，学生无上诉权\n利。\n\n5.  缺勤通知\n\na.  学校给家长发送自动电话讯息，告知学生无故缺勤的日期。电话讯息                                                                                                                                                \n                                        仅做告知用途，不用于计算累计缺勤次数。\n\nb.  家长可以通过 X2 门户查看所有的考勤数据。","家长可以通过 X2 门户查看所有的考勤数据。\nc.  成绩报告上的“Q”是一个警告，提醒学生和家长学生存在出勤问\n题。\n   季度：每门课程每季度 6 次级以上总缺勤或 2 次无故缺勤\n（AWOLs），将会导致成绩报告上出现“Q”成绩状态。\n   年度：每门课程年度 12 次及以上总缺勤或 4 次无故缺勤\n（AWOLs），将会导致成绩报告上出现“Q”成绩状态。\n   季度内出现“Q”成绩状态的学生需要面见他们的院长/项目\n协调员，商讨必要的措施和保障提高出勤率。会议的结果将\n会通知学生家长。\n6.  成绩单\n学生正式成绩单上只出现“N”标记。季度的“Q”标记只出现在成绩报告\n卡上。","7.  弥补措施\n学生如果某门课得了“N”，在某些情况下，可以通过暑假学校补课，前提\n是学生累计缺勤不超过 35 次(总课时的 25%，非满学期的课程按照学分折\n算)。缺勤超过总课时 25%之后，学生没有资格参加暑期学校“补回”该课\n程的学分。学生在这种情况下只有参加暑期学校完整修读该课程的全部原定\n学分，或在下一年重新修读这门课程。(请注意：BHS 暑期学校不开设“全\n部原定学分”的英语课程。）\n8.   上诉\n如果一个学生成功履行了其出勤改进计划，学生可通过院长请求校长考虑删"],"ground_truth":""}
{"question":"学校对“作弊”和“抄袭”的定义分别是什么？","answer":"作弊是指未经允许，拥有、传递、共享、获取或展示对学生有利的信息或材料。 而抄袭是指引用他人语句、数据、创意或观点，未在脚注或参考文献中注明的行为。","contexts":["抄袭\n抄袭是指引用他人语句、数据、创意或观点，未在脚注或参考文献中注明的行\n为。该行为包括原文引用、释义、改写，以及提交非本人完成的作业。\n作弊和抄袭处理制度：\n授课教师将会纠察日常家庭作业中的作弊和抄袭行为。其他所有作业同样适用\n该制度；任何申请学分的作业或作品，包括草稿和提纲，亦适用该制度。学生的作\n弊行为将被记入学生档案，并保存在管理员办公室。违规行为实行跨学科累积。例\n如，如果某学生二年级时在物理科目中作弊，后在三年级英语科目中抄袭，则该生\n违规两次。","[--- 以下为文件第 17 页内容 ---]\n作弊和抄袭之定义\n作弊\n作弊是指未经允许，拥有、传递、共享、获取或展示对学生有利的信息或材\n料。\n作弊行为包括但不限于：考试期间以任何方式传递信息，考试期间拥有或使用\n任何未经允许的材料或科技产品，在班级间传递考试相关的信息，以及提交非本人\n完成的作业。","[--- 以下为文件第 17 页内容 ---]\n作弊和抄袭之定义\n作弊\n作弊是指未经允许，拥有、传递、共享、获取或展示对学生有利的信息或材\n料。","教育宣传：\n所有学生在一年级第一学期将参加一次咨询课，了解作弊、抄袭的定义，以及\n学校关于学术不端的制度。咨询课不仅明确作弊和抄袭的定义，告知学生其后果，\n还特别强调，学生的行为代表着其个人以及布鲁克莱恩社区的品格。","此外，不当或非法使用电子设备将受到学校处罚，并/或移交警方处理。此违\n规情况包括使用电子设备侵犯学生、工作人员或教师的隐私，或涉嫌骚扰或诽谤。\n任何滥用电子设备的行为，包括使用科技产品作弊、抄袭或秘密记录他人交流内\n容，将导致电子设备被立即没收，并可能会引起其他可能的法律惩处和/或学校处\n罚。"],"ground_truth":""}
{"question":"学校可以随时大范围搜查学生的储物柜吗？警察搜查储物柜的前提条件是什么？","answer":"不可以，只有校长或他/她指定的人员认为学校存在安全威胁才能大范围搜查储物柜。警察搜查储物柜的前提是携带有效搜查令。","contexts":["(b) 禁止大范围搜查储物柜，除非校长或他/她指定的人员认为学校存在安全                                                                                                                                                     \n                                 威胁。\n\n(c) 警察如携带有效搜查令，可在任何时间搜查储物柜。","(b) 搜查程度必须与搜查目标匹配，不能超出该违纪行为的本质，不能超出学                                                                                                                                                     \n                                 生年龄和性别的适度范围，且必须在另一位学校管理人员的监察下执行。\n\n2.   搜查储物柜：","中小学校长、校长助理如对学生的身体、储物柜或财产进行搜查：","(a) 储物柜为布鲁克莱恩公立学校所有财产，学校教职工可在任何时间对其进                                                                                                                                                     \n                                 行检查。","搜查和没收\n\n校方的检查和没收行动以维护布鲁克莱恩公立学校学生和教职工的安全福利为                                                                                                                                                        \n                      宗旨。\n\n1.   美国最高法院对一切搜查标准的规定："],"ground_truth":""}
{"question":"国际留学生如果违反了校规，会不会被直接取消签证并遣返回国？","answer":"不会","contexts":["[--- 以下为文件第 22 页内容 ---]\n违禁 #1（以及再犯）：由涉事学生管理员举行学生、家长或监护人共同参\n加的聆讯。如果发现该学生确实违反了本条规定，则该生将被处以停学处\n罚，在此期间，校长将决定是否开除该生。","如学生违反本节条款并被开除学籍，则该生申请其他学校入学时，开除该\n生出校的学监应向接收该生学校的学监提交一份通知，说明该生被开除学\n籍的原因。\n\nh.  马萨诸塞州普通法第 71 章第 37H½节规定如下：","任何按照上述条款被开除出学区的学生都有权向学监提出上诉。被开除学\n生有权聘请律师参与学监举行的聆讯。上诉主题不应仅限于学生是否违反\n了本节任何条款的事实性判定。\ng.  如学生违反本节条款并被开除学籍，则该生申请其他学校入学时，开除该\n生出校的学监应向接收该生学校的学监提交一份通知，说明该生被开除学\n籍的原因。","违禁 #1：学生如违反布鲁克莱恩高中药品卫生制度将被转介参加药物滥\n用预防方案接受评估。学生如拒绝配合评估程序，将面临院长主持的校纪\n聆讯，且学生将被禁止参与任何学校举办的课外活动。","违禁 #1：通知学生家长或监护人，并让他们安排把学生从护士办公室带回\n家。学生必须有人监看，直至学生进入管理人员、家长/监护人的会谈现\n场。举行校纪聆讯，学生将被处以停学至少三天的处罚。学生须接受强制\n毒品教育和咨询辅导。学生还可能被剥夺参与学校课外活动的权利，禁止进\n入校园，甚至被校长开除学籍。"],"ground_truth":""}
{"question":"患有重度抑郁症的学生如果触犯了缺勤规定，心理医生可以为他开具豁免证明吗？","answer":"不知道","contexts":["b.\n学生如因突发卫生事件时间或住院时间延长而缺勤，可与教务长商\n议，教务长与校长讨论决定是否将该生的缺勤记入缺勤总次数上\n限。\n2.  申请缺勤\na.  家长/监护人必须在学生缺勤当天早上 10 点前联系教务长秘书，以\n便确保缺勤记录准确并有效安排后续的补课。任何时间均可在每个\n教务长/项目协调员办公室留言，以辅助缺勤报告。如缺勤申请在\n当天早上 10 点以后，该缺勤将被记录为无理由缺勤。\n   如家长错过了缺勤当天早上 10 点前这一截止时间，应最迟\n在三个上课日内通过便条、邮件或电话信息告知无理由缺勤\n原因。\n   三个工作日后，无理由缺勤将不再有机会转为有理由缺勤。","d.  第 10 次无故擅自缺勤（AWOLs）：课程的期末成绩为“N”。学生\n无上诉权。\ne.  由 3 次无故缺勤导致期末成绩为“N”的学期课程，可以视出勤改进\n计划和学生上诉情况最终确定。第 5 次无故缺勤之后，学生无上诉权\n利。","[--- 以下为文件第 11 页内容 ---]\nc.  第 6 次无故擅自缺勤（AWOLs）：课程成绩判定为“N”。征询教\n师意见。制定考勤改进计划，如果学生随后达到出勤改进计划的要\n求，在课程结束时，学生可以就本课程的“N”成绩上诉，且能够得\n到学校的支持。在考勤改进计划实施期间，之前及其后的无故擅自缺\n勤记录将累积计算（错误记录除外）。","7.  弥补措施\n学生如果某门课得了“N”，在某些情况下，可以通过暑假学校补课，前提\n是学生累计缺勤不超过 35 次(总课时的 25%，非满学期的课程按照学分折\n算)。缺勤超过总课时 25%之后，学生没有资格参加暑期学校“补回”该课\n程的学分。学生在这种情况下只有参加暑期学校完整修读该课程的全部原定\n学分，或在下一年重新修读这门课程。(请注意：BHS 暑期学校不开设“全\n部原定学分”的英语课程。）\n8.   上诉\n如果一个学生成功履行了其出勤改进计划，学生可通过院长请求校长考虑删","高出勤率能够促进所有班级、所有学生的学习和学业。\n学生在校时，必须参加所有既定的课程和项目。布鲁克莱恩高中制定出勤政\n策旨在促进学生学业，改善所有班级的学习环境。布鲁克莱恩高中希望家长\n/监护人和学生认识到出勤的重要性，谨慎考虑每一次缺勤请求。学校同样\n明确规定了学生因疾病或其他重大事件而缺勤时应遵守的程序。学生有责任\n完成缺勤期间丢下的功课。学生意外缺勤（如由于疾病）时，教师将为学生\n提供帮助，但对有计划缺勤的学生，教师不会提前为其布置作业、重新讲解\n教学内容或重补课程。"],"ground_truth":""}
