{"question":"对于一年期的课程，学生最多允许缺勤多少次？","answer":"对于一年期的课程，学生最多只能缺勤 21 次。","contexts":["1.  缺勤总次数上限（有理由和/或无理由）\n布鲁克莱恩高中希望学生正常上课和出勤。学校课业学分包括作业评级和\n学习社区参与度。对一年期的课程，学生最多只能缺勤 21 次（占每个课\n程 140 以上天数的 15%），一学期的课程最多缺勤 11 次，两天/周的学期\n课程最多缺勤 6 次。任何缺勤总次数超过该上线的课程将没有学分。达不\n到上述出勤标准的学生，其成绩单上的最终评级将为“N”。","d.  第 10 次无故擅自缺勤（AWOLs）：课程的期末成绩为“N”。学生\n无上诉权。\ne.  由 3 次无故缺勤导致期末成绩为“N”的学期课程，可以视出勤改进\n计划和学生上诉情况最终确定。第 5 次无故缺勤之后，学生无上诉权\n利。","a.\n首次及其后的无故擅自缺勤（AWOLs）：教师告知学生，无理由缺\n席当天学生所得的作业分数最多不超过总分的一半，包括大小测验的\n成绩。\nb.   1 次以上、5 次以下无故擅自缺勤（AWOLs）：教师和院长按纪律条\n例视情节给予学生处分，其中可能包括与家长沟通，课后留堂，禁止\n进入 X 活动区（X-block），直至停学和留级。","由 3 次无故缺勤导致期末成绩为“N”的学期课程，可以视出勤改进\n计划和学生上诉情况最终确定。第 5 次无故缺勤之后，学生无上诉权\n利。\n\n5.  缺勤通知\n\na.  学校给家长发送自动电话讯息，告知学生无故缺勤的日期。电话讯息                                                                                                                                                \n                                        仅做告知用途，不用于计算累计缺勤次数。\n\nb.  家长可以通过 X2 门户查看所有的考勤数据。","a.  所有缺勤，无论有无理由，都将记入缺勤总次数上限。以下情况除                                                                                                                                                 \n                                        外：宗教节日、马萨诸塞州综合评估系统测试（MCAS）、大学先"],"ground_truth":"对于一年期的课程，学生最多只能缺勤 21 次 。"}
{"question":"SMARTS 制度中的字母 “M” 和 “S(最后一个)” 分别代表什么意思？","answer":"M（习惯）：布鲁克莱恩高中的毕业生将具有良好的科技产品使用习惯。\n\nS（静音）： 使用所有科技产品必须静音。","contexts":["S（学生）：            学生在布鲁克莱恩高中可以使用科技产品\nM（习惯）：布鲁克莱恩高中的毕业生将具有良好的科技产品使用习惯。\nA（助人）：            学生应乐于帮助他人\nR（礼貌）：            学生使用科技产品时必须有礼貌\nT（教师）：            教师决定在其课堂中科技产品能否使用以及使用方式\nS（静音）： 使用所有科技产品必须静音","[--- 以下为文件第 18 页内容 ---]\n规章 1.4：个人电子设备使用制度\n布鲁克莱恩高中认识到了当今世界科技的广泛应用。然而我们的校园文化建设\n同时也高度重视人际互动，重视现实生活中人与人之间的密切往来。考虑到这两方\n面的现实情况，我们主张 SMARTS 制度：","教室电子产品使用：每位教师对科技产品的使用规定将作为教学大纲或课程规划\n的一部分，以书面形式告知学生。此外，SMARTS                                            政策规定宣传画应在每个教室\n的显眼处展示。","抄袭\n抄袭是指引用他人语句、数据、创意或观点，未在脚注或参考文献中注明的行\n为。该行为包括原文引用、释义、改写，以及提交非本人完成的作业。\n作弊和抄袭处理制度：\n授课教师将会纠察日常家庭作业中的作弊和抄袭行为。其他所有作业同样适用\n该制度；任何申请学分的作业或作品，包括草稿和提纲，亦适用该制度。学生的作\n弊行为将被记入学生档案，并保存在管理员办公室。违规行为实行跨学科累积。例\n如，如果某学生二年级时在物理科目中作弊，后在三年级英语科目中抄袭，则该生\n违规两次。","a.\n首次及其后的无故擅自缺勤（AWOLs）：教师告知学生，无理由缺\n席当天学生所得的作业分数最多不超过总分的一半，包括大小测验的\n成绩。\nb.   1 次以上、5 次以下无故擅自缺勤（AWOLs）：教师和院长按纪律条\n例视情节给予学生处分，其中可能包括与家长沟通，课后留堂，禁止\n进入 X 活动区（X-block），直至停学和留级。"],"ground_truth":" “M” 代表习惯（布鲁克莱恩高中的毕业生将具有良好的科技产品使用习惯）；最后一个 “S” 代表静音（使用所有科技产品必须静音）。"}
{"question":"学校规定的“含酒精饮料”的标准是什么？","answer":"华氏60°时酒精含量达到或超过1.5%的、适用于人类饮用的液体。","contexts":["[--- 以下为文件第 13 页内容 ---]\n规章 1.2：校内或学校举办的活动场所实施毒品及饮酒零容忍政策\n布鲁克莱恩学校认为未成年人拥有和/或使用非法药品/毒品、非法拥有和/或饮\n用酒精饮料，将会严重损害学生的身体和/或情绪状态。因此，布鲁克莱恩高中制\n定了严格的规章，在校内或在学校举办的活动，包括运动会以及非教学日的校外\n社会活动，禁止拥有、出售、转让或使用以上物品。","法律定义\n\n“含酒精饮料”：华氏                      60°时酒精含量达到或超过                       1.5%的、适用于人类消费的液                                                                                                             \n                      体。G.L.c.138，S.1\n\n“管控物品”：G.L.c.94C                   定义的一切管控物品或药品。","[--- 以下为文件第 13 页内容 ---]\n\n规章 1.2：校内或学校举办的活动场所实施毒品及饮酒零容忍政策","E.药品卫生制度\n\n布鲁克莱恩高中学生均受规章                           1.2 之约束。此外，所有的学生，包括运动员，                                                                                                                           \n                      在学校外面均受以下药品卫生制度对非法使用酒精和非法药物的规定之约束。\n\n药品卫生制度：","B.使用（出现吸毒或饮酒状态）：教工或学生如有可据理由怀疑学生表现出吸毒或\n饮酒状态应向学校管理人员报告。学生管理人员将就此展开调查，在适当情况下，\n应采取以下步骤："],"ground_truth":"含酒精饮料”是指华氏 60° 时酒精含量达到或超过 1.5% 的、适用于人类消费的液体 。"}
{"question":"如果学生被发现在校园内吸烟，第一次和第二次被发现分别会受到什么具体处罚？","answer":"第一次被发现会在一周内不得在校使用手机，一个月不得参加Ｘ区活动。第二次会被剥夺参与学校课外活动的权利，禁止进入校园。","contexts":["A.藏有：教工或学生如有可据理由怀疑学生藏有毒品或酒精应向学校管理人员报\n告。学生管理人员将就此展开调查，并可以请求警方参与；适当情况下，应采取以\n下步骤：\n违禁 #1：通知学生父母或监护人，举行校纪聆讯，处以学生至少五天停学\n处罚。学生须接受强制的毒品教育和咨询辅导。学生还可能被剥夺参与学\n校课外活动的权利，禁止进入校园，甚至被校长开除学籍。","[--- 以下为文件第 22 页内容 ---]\n违禁 #1（以及再犯）：由涉事学生管理员举行学生、家长或监护人共同参\n加的聆讯。如果发现该学生确实违反了本条规定，则该生将被处以停学处\n罚，在此期间，校长将决定是否开除该生。","2.   第二次及之后的违禁：运动员主任，或由校长或校长指定负责人召开的校纪聆\n讯，如果确定某一学生存在违禁事实，该生将失去参加此后系列校际比赛的资\n格，占该运动校际比赛总场次的 60%。第二次及以上违禁后，学生如自愿加入\n获得学校批准认可的治疗方案，则学生可能有机会在赛事结束 40%之后重新取\n得参赛资格。","违禁 #1：学生、家长和管理员应与校长会晤，做出纪律处分决定，包括开\n除学籍。学生将接受强制戒毒教育和辅导，禁止进入校园，而且可能被禁止\n参加学校举办的课外活动。","设备                     续违规可能受到的惩罚，包括停学。学生至少一周不\n得在校使用手机，一个月不得参加Ｘ区活动。\n禁止进入校园"],"ground_truth":" 第一次违规：学生将受到警告，校方会致电家长或监护人，并寄出信函或电子邮件告知违规行为 。第二次违规：学生将被要求参加烟草教育课程（TEP）。"}
{"question":"发生哪些事件时，学校的授权报告机构必须立即向警方报告？请列举至少三项。","answer":"学校财产范围内；学校财产 1000 英尺半径范围内；学校资助的活动上；学校所有或学校合同签有的交通工具内。","contexts":["下列授权报告事件发生时，授权报告机构将立即向指定的联络警方报告：\n    学校财产范围内\n    学校财产 1000 英尺半径范围内\n    学校资助的活动上\n    学校所有或学校合同签有的交通工具内","授权报告事件列表\n    任何有合理根据怀疑或判定任何个人拥有、销售或分发马萨诸塞州普通\n法第 94 章规定的酒类、吸入剂或任何管制物品的事件\n    除意外事故之外，任何导致严重人身伤害或重大财产损坏或损失的事\n件，或存在此类威胁的活动\n    任何个人拥有马萨诸塞州普通法第                                269  章第      10  节规定的枪械或危险武\n器，或用其进行威胁，或拥有其他能够造成混乱、警报、伤害或破坏学\n校社区整体福利的物品\n    任何性侵犯和强奸；不友好的搭讪或侮辱行为；令人恼怒或严重的人身\n骚扰，包括但不仅限于：种族、性别、民族血统、宗教、残疾或性倾向\n骚扰等\n    任何涉及家庭暴力、虐待、约会暴力，或违反马萨诸塞州普通法第\n209A 章限令的事件\n    任何涉及身体虐待或性虐待儿童的事件","A.藏有：教工或学生如有可据理由怀疑学生藏有毒品或酒精应向学校管理人员报\n告。学生管理人员将就此展开调查，并可以请求警方参与；适当情况下，应采取以\n下步骤：","A.藏有：教工或学生如有可据理由怀疑学生藏有毒品或酒精应向学校管理人员报\n告。学生管理人员将就此展开调查，并可以请求警方参与；适当情况下，应采取以\n下步骤：\n违禁 #1：通知学生父母或监护人，举行校纪聆讯，处以学生至少五天停学\n处罚。学生须接受强制的毒品教育和咨询辅导。学生还可能被剥夺参与学\n校课外活动的权利，禁止进入校园，甚至被校长开除学籍。","    任何涉及或涉嫌犯下仇恨罪行或侵犯公民权利的事件\n    任何纵火事件或威胁，或涉及燃烧装置或爆炸物的事件\n\n所有员工都将遵守学校的建筑设施范围内标准应对措施方案，及时报告上述事                                                                                                                                                        \n                      件。"],"ground_truth":"必须报告的事件包括（列举三项即可）：拥有、销售或分发酒类、吸入剂或管制物品 。导致严重人身伤害或重大财产损坏或损失的事件 。拥有枪械或危险武器 。任何性侵犯、强奸、骚扰 。家庭暴力、虐待、约会暴力 。身体虐待或性虐待儿童 。仇恨罪行或侵犯公民权利 。纵火或涉及爆炸物的事件 。"}
{"question":"如果一名参加了特殊教育计划（IEP）的学生在一个学年内的累计停学时间达到10天，学校需要遵守什么特定程序？","answer":"根据美国残疾儿童教育法案规定，在 1988 年 Honig v.Doe 的案件中，美国最高法院裁决学生在一个学年的停学时间总数累计如达到或超过十天，则构成更换安置地点的条件。因此，该类停学需要遵守以下程序：与该生的残疾有关；属于该生特殊教育计划不当或安置不当的结果；或者属于该生特殊教育计划未得到完全执行的结果","contexts":["b)  如特殊需求学生一个学年内的停学时间累计不超过                                              10  天，则\n根据学校委员会“纪律守则规章”第 A 节第 4 条款和上述第 3\n条规定，该生可立即被实行停学处理。","c)  如立即停学处理可能导致学生一个学年内停学时间累计超过\n10  天，则该生不可被停学，除非学校领导得到该生家长同\n意，或该生家长/监护人不同意时，学校接到法院命令同意该\n停学处理。","4.  该生的停学次数及停学时间应记录并保存到该生的特殊教育计划文                                                                                                                                               \n                                          件中，直到下一期特殊教育计划开始执行。\n\n4.   如特殊教育学生一学年里的累积停学时间达到或超过十天，则执行以下政策：","根据美国残疾儿童教育法案规定，在 1988 年 Honig v.Doe 的案件中，美国最高\n法院裁决学生在一个学年的停学时间总数累计如达到或超过十天，则构成更换\n安置地点的条件。[参阅                      Honig v.Doe 108 S.Ct582（1988）]。因此，该类停学\n需要遵守以下程序：","与该生的残疾有关；\nii.\n属于该生特殊教育计划不当或安置不当的结果；或\niii.\n属于该生特殊教育计划未得到完全执行的结果\nc.  如复审团队认为该生的行为与上述第 4 节 b 条款所列三个因素中的任一因\n素相关，则不可对该生实行一学年累计十天以上的停学处理，且\ni.    必须对该生的特殊教育计划进行修改，制定出一个更能有效满足\n该生需求的新计划，或如该生的特殊教育计划是恰当的，但该生\n的行为是其特教计划未能完全执行的结果，则学校必须采取所有\n应当采取的措施保证该生的特殊教育计划得到完全执行。"],"ground_truth":"学生服务中心副学监或指定人员必须召集制定该生特殊教育计划的团队复审该计划，并书面通知学生家长或监护人 。复审团队需要决定该生的行为是否与残疾有关、是否是安置不当的结果、或是计划未完全执行的结果 。如果与上述因素有关，则不可实行一学年累计十天以上的停学处理，且必须修改计划或保证计划得到完全执行 。"}
{"question":"一名校队运动员如果是第一次违反药品卫生制度，他对后续比赛的参与资格会受到什么具体影响？如果是第二次违规呢？","answer":"首次违禁：运动员主任，或由校长或校长指定负责人召开的校纪聆讯，如果确定某一学生存在违禁事实，该生将失去参加此后系列校际比赛的资格，占该运动校际比赛总场次的 25%。\n\n第二次及之后的违禁：运动员主任，或由校长或校长指定负责人召开的校纪聆讯，如果确定某一学生存在违禁事实，该生将失去参加此后系列校际比赛的资格，占该运动校际比赛总场次的 60%。","contexts":["[--- 以下为文件第 15 页内容 ---]\nMIAA 学生运动员化学药品卫生政策追加处罚：\n1.   首次违禁：运动员主任，或由校长或校长指定负责人召开的校纪聆讯，如果确\n定某一学生存在违禁事实，该生将失去参加此后系列校际比赛的资格，占该运\n动校际比赛总场次的                    25%（见       MIAA 手册，2005 年               7 月    1 日）。任何被医治\n项目收治的学生均不得例外。为辅助康复，建议可以让学生继续保持练习。","2.   第二次及之后的违禁：运动员主任，或由校长或校长指定负责人召开的校纪聆\n讯，如果确定某一学生存在违禁事实，该生将失去参加此后系列校际比赛的资\n格，占该运动校际比赛总场次的 60%。第二次及以上违禁后，学生如自愿加入\n获得学校批准认可的治疗方案，则学生可能有机会在赛事结束 40%之后重新取\n得参赛资格。","违规情况#2：布鲁克莱恩警方报告学生违反药品卫生管理制度后，该生姓\n名将被提交给表演系主任和教职员工。主任和教职员工将采取下列惩处措\n施：涉事学生必须参加注意力转移项目，接受疏导和教育，以使他们能成功\n回归表演系的角色中。此外，学生还将被罚以以下惩处：\n1.)如学生目前正在参加任何课外表演作品的试镜，她/他将失去参加该作品\n下一次演出的资格。","违规情况#1：布鲁克莱恩警方报告学生违反药品卫生管理制度后，该生姓\n名将被提交给表演系主任和教职员工。主任和教职员工将采取下列惩处措\n施：涉事学生必须参加注意力转移项目，接受毒品教育，以使他们能成功回\n归表演系的角色中。此外，学生还将被罚以以下惩处：\n1.)如学生目前正在参加任何课外表演作品的试镜，她/他将失去参加该作品\n下一次演出的资格。","违禁 #1：学生如违反布鲁克莱恩高中药品卫生制度将被转介参加药物滥\n用预防方案接受评估。学生如拒绝配合评估程序，将面临院长主持的校纪\n聆讯，且学生将被禁止参与任何学校举办的课外活动。"],"ground_truth":"第一次违规，该生将失去参加此后系列校际比赛的资格，占该运动校际比赛总场次的 25% 。第二次及之后的违规，该生将失去参加此后系列校际比赛的资格，占该运动校际比赛总场次的 60% 。"}
{"question":"无故缺勤达到第6次和第10次时，学生成绩的处理和上诉权利有什么不同？","answer":"无故缺勤达到第6次时：课程成绩判定为“N”，教师征询意见，并制定考勤改进计划；如果学生随后达到出勤改进计划的要求，在课程结束前可以就本课程的“N”成绩上诉，且能得到学校的支持。之前及其后的无故擅自缺勤记录将累积计算（错误记录除外）。\n\n无故缺勤达到第10次时：课程的期末成绩为“N”。学生无上诉权。","contexts":["d.  第 10 次无故擅自缺勤（AWOLs）：课程的期末成绩为“N”。学生\n无上诉权。\ne.  由 3 次无故缺勤导致期末成绩为“N”的学期课程，可以视出勤改进\n计划和学生上诉情况最终确定。第 5 次无故缺勤之后，学生无上诉权\n利。","[--- 以下为文件第 11 页内容 ---]\nc.  第 6 次无故擅自缺勤（AWOLs）：课程成绩判定为“N”。征询教\n师意见。制定考勤改进计划，如果学生随后达到出勤改进计划的要\n求，在课程结束时，学生可以就本课程的“N”成绩上诉，且能够得\n到学校的支持。在考勤改进计划实施期间，之前及其后的无故擅自缺\n勤记录将累积计算（错误记录除外）。","由 3 次无故缺勤导致期末成绩为“N”的学期课程，可以视出勤改进\n计划和学生上诉情况最终确定。第 5 次无故缺勤之后，学生无上诉权\n利。\n\n5.  缺勤通知\n\na.  学校给家长发送自动电话讯息，告知学生无故缺勤的日期。电话讯息                                                                                                                                                \n                                        仅做告知用途，不用于计算累计缺勤次数。\n\nb.  家长可以通过 X2 门户查看所有的考勤数据。","a.\n首次及其后的无故擅自缺勤（AWOLs）：教师告知学生，无理由缺\n席当天学生所得的作业分数最多不超过总分的一半，包括大小测验的\n成绩。\nb.   1 次以上、5 次以下无故擅自缺勤（AWOLs）：教师和院长按纪律条\n例视情节给予学生处分，其中可能包括与家长沟通，课后留堂，禁止\n进入 X 活动区（X-block），直至停学和留级。","a.   首次及其后的无故擅自缺勤（AWOLs）：教师告知学生，无理由缺\n席当天学生所得的作业分数最多不超过总分的一半，包括大小测验的\n成绩。"],"ground_truth":" 第 6 次无故擅自缺勤时，课程成绩判定为 “N”，但如果学生随后达到出勤改进计划的要求，在课程结束时可以就该成绩上诉并得到学校支持 。第 10 次无故擅自缺勤时，课程的期末成绩为 “N”，且学生无上诉权 。"}
{"question":"学校对“作弊”和“抄袭”的定义分别是什么？","answer":"作弊是指未经允许，拥有、传递、共享、获取或展示对学生有利的信息或材料。\n\n抄袭是指引用他人语句、数据、创意或观点，未在脚注或参考文献中注明的行为。该行为包括原文引用、释义、改写，以及提交非本人完成的作业。","contexts":["抄袭\n抄袭是指引用他人语句、数据、创意或观点，未在脚注或参考文献中注明的行\n为。该行为包括原文引用、释义、改写，以及提交非本人完成的作业。\n作弊和抄袭处理制度：\n授课教师将会纠察日常家庭作业中的作弊和抄袭行为。其他所有作业同样适用\n该制度；任何申请学分的作业或作品，包括草稿和提纲，亦适用该制度。学生的作\n弊行为将被记入学生档案，并保存在管理员办公室。违规行为实行跨学科累积。例\n如，如果某学生二年级时在物理科目中作弊，后在三年级英语科目中抄袭，则该生\n违规两次。","[--- 以下为文件第 17 页内容 ---]\n作弊和抄袭之定义\n作弊\n作弊是指未经允许，拥有、传递、共享、获取或展示对学生有利的信息或材\n料。\n作弊行为包括但不限于：考试期间以任何方式传递信息，考试期间拥有或使用\n任何未经允许的材料或科技产品，在班级间传递考试相关的信息，以及提交非本人\n完成的作业。","[--- 以下为文件第 17 页内容 ---]\n作弊和抄袭之定义\n作弊\n作弊是指未经允许，拥有、传递、共享、获取或展示对学生有利的信息或材\n料。","学生如作弊或抄袭，则不得参选国家荣誉生，并可能无法获得有品德要求的奖                                                                                                                                                        \n                      学金。","抄袭\n抄袭是指引用他人语句、数据、创意或观点，未在脚注或参考文献中注明的行\n为。该行为包括原文引用、释义、改写，以及提交非本人完成的作业。"],"ground_truth":"作弊是指未经允许，拥有、传递、共享、获取或展示对学生有利的信息或材料 。抄袭是指引用他人语句、数据、创意或观点，未在脚注或参考文献中注明的行为 。"}
{"question":"学校可以随时大范围搜查学生的储物柜吗？警察搜查储物柜的前提条件是什么？","answer":"不可以，警察搜查储物柜的前提是校长或他/她指定的人员认为学校存在安全威胁。","contexts":["(b) 禁止大范围搜查储物柜，除非校长或他/她指定的人员认为学校存在安全                                                                                                                                                     \n                                 威胁。\n\n(c) 警察如携带有效搜查令，可在任何时间搜查储物柜。","(b) 搜查程度必须与搜查目标匹配，不能超出该违纪行为的本质，不能超出学                                                                                                                                                     \n                                 生年龄和性别的适度范围，且必须在另一位学校管理人员的监察下执行。\n\n2.   搜查储物柜：","中小学校长、校长助理如对学生的身体、储物柜或财产进行搜查：","(a) 储物柜为布鲁克莱恩公立学校所有财产，学校教职工可在任何时间对其进                                                                                                                                                     \n                                 行检查。","我们对你的建议是：任何你不愿学校管理人员或警察知道的东西，都不要带任                                                                                                                                                        \n                      何东西到学校，更不要在储物柜中存放。\n\nII.C.  学校委员会对特殊教育计划（IEP's）学生的纪律规定"],"ground_truth":"禁止大范围搜查储物柜，除非校长或他/她指定的人员认为学校存在安全威胁 。警察搜查储物柜的前提条件是必须携带有效搜查令 。"}
{"question":"国际留学生如果违反了校规，会不会被直接取消签证并遣返回国？","answer":"不会","contexts":["[--- 以下为文件第 22 页内容 ---]\n违禁 #1（以及再犯）：由涉事学生管理员举行学生、家长或监护人共同参\n加的聆讯。如果发现该学生确实违反了本条规定，则该生将被处以停学处\n罚，在此期间，校长将决定是否开除该生。","如学生违反本节条款并被开除学籍，则该生申请其他学校入学时，开除该\n生出校的学监应向接收该生学校的学监提交一份通知，说明该生被开除学\n籍的原因。\n\nh.  马萨诸塞州普通法第 71 章第 37H½节规定如下：","5.   校长与学监商讨后，可对学生处以开除（永久开除学籍）或 10 天以上的停学处\n罚。学生因其所控违纪行为被开除学籍前，校长必须为学生及他/她的家长举行\n公正的校记聆讯（马萨诸塞州普通法第 76 章第 17 节）。学校通知学生及他/她\n的家长聆讯时，必须为学生及他/她的家长提供一份“高中纪律守则”对于开除\n学籍的规定。聆讯时，学生在程序上享有以下权利：","[--- 以下为文件第 5 页内容 ---]\n\n(a) 必须出示合理的理由怀疑学生违反了学校的规章制度，藏有违禁物品或盗                                                                                                                                                     \n                                 取他人财产；及","任何按照上述条款被开除出学区的学生都有权向学监提出上诉。被开除学\n生有权聘请律师参与学监举行的聆讯。上诉主题不应仅限于学生是否违反\n了本节任何条款的事实性判定。\ng.  如学生违反本节条款并被开除学籍，则该生申请其他学校入学时，开除该\n生出校的学监应向接收该生学校的学监提交一份通知，说明该生被开除学\n籍的原因。"],"ground_truth":"抱歉，当前文档中并未提及关于国际留学生签证取消或被遣返回国的相关规定。（系统不应自行编造移民局相关的惩罚）。"}
{"question":"患有重度抑郁症的学生如果触犯了缺勤规定，心理医生可以为他开具豁免证明吗？","answer":"不知道","contexts":["a.  所有缺勤，无论有无理由，都将记入缺勤总次数上限。以下情况除                                                                                                                                                 \n                                        外：宗教节日、马萨诸塞州综合评估系统测试（MCAS）、大学先","(2)一旦学生被判触犯重罪，或被裁决，或在法庭承认犯有重罪罪行或\n行为不良重罪，该生所在学校的校长如认为该生继续在校可能极大损\n害学校的整体福利，则该校长可将其开除学籍。被开除学籍前，该生\n会收到相关通知说明其受到的控诉以及被开除学籍的原因。该生还会\n收到一份书面通知，告知其上诉的权利以及上诉的程序；然而，在学\n监举行上诉聆讯前，该生的开除学籍处罚仍将有效。","a.\n首次及其后的无故擅自缺勤（AWOLs）：教师告知学生，无理由缺\n席当天学生所得的作业分数最多不超过总分的一半，包括大小测验的\n成绩。\nb.   1 次以上、5 次以下无故擅自缺勤（AWOLs）：教师和院长按纪律条\n例视情节给予学生处分，其中可能包括与家长沟通，课后留堂，禁止\n进入 X 活动区（X-block），直至停学和留级。","马萨诸塞州普通法第 71 章第 37H½节规定如下：\n(1)一旦学生因涉嫌触犯严重罪行被提起刑事诉讼或学生被控行为不良\n重罪，如该生所在学校的校长认为该生继续在校可能极大损害学校的\n整体福利，则该校长可对学生处以停学处罚，停学时间由校长视情况\n决定。停学处罚实施前，该生会收到相关通知说明其受到的控诉以及\n停学的原因。该生还会收到一份书面通知，告知其上诉的权利以及上\n诉的程序；然而，在学监举行上诉聆讯前，该生的停学处罚仍将有\n效。","b.  学生如因突发卫生事件时间或住院时间延长而缺勤，可与教务长商\n议，教务长与校长讨论决定是否将该生的缺勤记入缺勤总次数上\n限。"],"ground_truth":" 根据文档，学生如因突发卫生事件时间或住院时间延长而缺勤，可与教务长商议，由教务长与校长讨论决定是否将缺勤记入缺勤总次数上限 。但文档并未明确提及“心理医生开具豁免证明”的具体流程。"}
{"question":"根据《2012法案》第222章，学校有责任为连续停学多少天以上的学生制定全校教育服务计划？","answer":"10个上课日","contexts":["任何连续停学              10  个上课日以上的学生都有权获得由各校校长制定的全校教育\n服务计划，从而获得教育服务，以期在停学期间也能取得学业进步。停学时间等于\n或少于        10  个上课日的学生也可获得停学期间的教育机会。如无严重违纪行为，学\n校不可对学生处以                  90  个上课日以上的停学处罚。对某些违纪行为，正当程序和诉\n讼需要学生和家长和/或监护人共同参与。学校校长拥有自由裁量权处罚学生的违\n纪行为。","2014 年 7 月 1 日，《2012 法案》第 222 章（《关于学生获得教育服务及学生\n停学的法案》）在马萨诸塞州生效。根据该法案规定，学校有责任确保停学的学生\n能够在停学期间继续取得学业进步。","或相关部门（如公共安全部、医疗卫生服务部、住房及非营利机构等）工作人员参\n与。如学生尚未毕业且连续缺勤                              10  天，学生将会有一次离校谈话，以便学生选择\n另类教育或其他教育方式。","规章 2.1：禁止打架和使用暴力\n违禁 #1：学校将立即通知学生家长/监护人，学生处以                                              3 天以下停学。（根\n据程序法规，此类情况应视作“紧急情况”，参见第                                               II 章    A 条款。）学校\n将尽快安排涉事学生、学生父母或监护人以及学校相关管理人员共同参加校\n纪聆讯。调解是必不可少的途径。","b)  如特殊需求学生一个学年内的停学时间累计不超过                                              10  天，则\n根据学校委员会“纪律守则规章”第 A 节第 4 条款和上述第 3\n条规定，该生可立即被实行停学处理。"],"ground_truth":"任何连续停学10个上课日以上的学生都有权获得由各校校长制定的全校教育服务计划，以期在停学期间也能取得学业进步。"}
{"question":"在没有严重违纪行为的情况下，学校对学生的停学处罚最长不能超过多少个上课日？","answer":"90 个上课日","contexts":["任何连续停学              10  个上课日以上的学生都有权获得由各校校长制定的全校教育\n服务计划，从而获得教育服务，以期在停学期间也能取得学业进步。停学时间等于\n或少于        10  个上课日的学生也可获得停学期间的教育机会。如无严重违纪行为，学\n校不可对学生处以                  90  个上课日以上的停学处罚。对某些违纪行为，正当程序和诉\n讼需要学生和家长和/或监护人共同参与。学校校长拥有自由裁量权处罚学生的违\n纪行为。","4.   学生可按上述程序就停学处罚向校长、学监上诉，某些情况下还可向学校委员\n会上诉。停学处罚必须在上诉处理完成后方可执行。上诉必须在 10 个上课日内\n处理完成。","5.   校长与学监商讨后，可对学生处以开除（永久开除学籍）或 10 天以上的停学处\n罚。学生因其所控违纪行为被开除学籍前，校长必须为学生及他/她的家长举行\n公正的校记聆讯（马萨诸塞州普通法第 76 章第 17 节）。学校通知学生及他/她\n的家长聆讯时，必须为学生及他/她的家长提供一份“高中纪律守则”对于开除\n学籍的规定。聆讯时，学生在程序上享有以下权利：","违禁 #1：通知学生家长或监护人，并让他们安排把学生从护士办公室带回\n家。学生必须有人监看，直至学生进入管理人员、家长/监护人的会谈现\n场。举行校纪聆讯，学生将被处以停学至少三天的处罚。学生须接受强制\n毒品教育和咨询辅导。学生还可能被剥夺参与学校课外活动的权利，禁止进\n入校园，甚至被校长开除学籍。","c)  如立即停学处理可能导致学生一个学年内停学时间累计超过\n10  天，则该生不可被停学，除非学校领导得到该生家长同\n意，或该生家长/监护人不同意时，学校接到法院命令同意该\n停学处理。"],"ground_truth":"如无严重违纪行为，学校不可对学生处以90个上课日以上的停学处罚。"}
{"question":"在执行10天及以下的停学处罚前，“正常法律程序”规定学生在聆讯会上应享有哪些权利？","answer":"a.  关于本次控诉的口头或书面通知（纪律通告可以作为书面通知）；\r\nb.  控诉他/她的证据解说；\r\nc.  他/她有机会代表自身陈述事件过程。","contexts":["2.  根据美国宪法第 14 条修正案，全校所有教职员工都应按照“正常法律程序”对\n待学生。“正常法律程序”指除认定的紧急事件外，学生在被执行 10 天及以下\n停学处罚或其他重大纪律处分前，有权参加由教务长、项目协调员或校长举行\n的聆讯。聆讯会上，学生应收到：\na.  关于本次控诉的口头或书面通知（纪律通告可以作为书面通知）；\nb.  控诉他/她的证据解说；\nc.  他/她有机会代表自身陈述事件过程。","5.   校长与学监商讨后，可对学生处以开除（永久开除学籍）或 10 天以上的停学处\n罚。学生因其所控违纪行为被开除学籍前，校长必须为学生及他/她的家长举行\n公正的校记聆讯（马萨诸塞州普通法第 76 章第 17 节）。学校通知学生及他/她\n的家长聆讯时，必须为学生及他/她的家长提供一份“高中纪律守则”对于开除\n学籍的规定。聆讯时，学生在程序上享有以下权利：","违禁     #2：执行上述违禁#1 的所有处分，并处以 10 天以下停学，学生须接受\n辅导，校长召开由学生、学生家长或监护人以及校管理人员共同参加的聆\n讯，并视情节决定采取渐进的纪律措施。","d.  聆讯会后，校长行使自由裁量权，决定给予裁定违反(a)或(b)条款的学生\n停学处罚，而非将其开除出学校。然而，若校长决定给予上述学生停学处\n罚，校长应向学监提交一份书面说明，详述选择停学而非开除学籍处罚作\n为最恰当解决方法的原因。","该生有权就停学处罚向学监上诉。该生须在停学处罚生效后的五个日\n历日内以书面形式向学监提交上诉请求。学监须在该生提交上诉请求\n后的三个日历日内为该生及该生家长或监护人举行聆讯。聆讯现场，\n该生有权以自身名义陈述和出示口头和书面证词，有权聘请律师。学"],"ground_truth":"学生应收到关于本次控诉的口头或书面通知，听取控诉证据解说，并有机会代表自身陈述事件过程。"}
{"question":"学生就停学处罚向上诉时，上诉必须在多少时间内处理完成？","answer":"10 个上课日内","contexts":["4.   学生可按上述程序就停学处罚向校长、学监上诉，某些情况下还可向学校委员\n会上诉。停学处罚必须在上诉处理完成后方可执行。上诉必须在 10 个上课日内\n处理完成。","该生有权就停学处罚向学监上诉。该生须在停学处罚生效后的五个日\n历日内以书面形式向学监提交上诉请求。学监须在该生提交上诉请求\n后的三个日历日内为该生及该生家长或监护人举行聆讯。聆讯现场，\n该生有权以自身名义陈述和出示口头和书面证词，有权聘请律师。学","[--- 以下为文件第 4 页内容 ---]\n监有权推翻或更改校长的决定，包括为该生推荐替代教育项目。学监\n须在聆讯后的五个日历日内宣告上诉判决。该判决为该生停学处罚在\n其所在城市、城镇或地区学区的最终结果。","2.  根据美国宪法第 14 条修正案，全校所有教职员工都应按照“正常法律程序”对\n待学生。“正常法律程序”指除认定的紧急事件外，学生在被执行 10 天及以下\n停学处罚或其他重大纪律处分前，有权参加由教务长、项目协调员或校长举行\n的聆讯。聆讯会上，学生应收到：\na.  关于本次控诉的口头或书面通知（纪律通告可以作为书面通知）；\nb.  控诉他/她的证据解说；\nc.  他/她有机会代表自身陈述事件过程。","该生有权就开除学籍的处罚向学监上诉。该生须在开除学籍处罚生效\n的五个日历日内以书面形式向学监提交上诉请求。学监须在该生开除\n学籍处罚生效后的三个日历日内为该生及该生家长或监护人举行聆\n讯。聆讯现场，该生有权以自身名义陈述和出示口头和书面证词，有\n权聘请律师。学监有权推翻或更改校长的决定，包括为该生推荐替代\n教育项目。学监须在聆讯后的五个日历日内宣告上诉判决。该判决为\n该生开除学籍处罚在其所在城市、城镇或地区学区的最终结果。"],"ground_truth":"上诉必须在10个上课日内处理完成。"}
{"question":"如果学生在学校活动中被发现携带危险武器或管制物品，校长可以采取什么终极纪律处分？","answer":"可能被校长开除出学校或学区。","contexts":["i.  马萨诸塞州普通法第 71 章第 37H½节规定：学生如在学校宿舍、学校活动\n或与学校有关的活动（包括竞技游戏）中被发现携带危险武器（包括但不\n仅限于枪支或刀具）或第                         94  章    C  规定的管制物品（包括但不仅限于大\n麻、可卡因、海洛因等），可能被校长开除出学校或学区。学生如在学校\n宿舍、学校活动或与学校有关的活动（包括竞技游戏）中攻击校长、副校\n长、教师、教师助理或其他教学员工，可能会被校长开除出学校或学区。\n任何被控诉违反(a)或(b)条款的学生会收到一份参加聆讯的书面通知；假\n如该学生准备了自我陈述，该生可在上述聆讯现场向校长出示证据和证\n人。","a.  学生如在学校宿舍、学校活动或与学校有关的活动（包括竞技游戏）中被\n发现携带危险武器（包括但不仅限于枪支或刀具）或第                                                  94 章    C 规定的管\n制物品（包括但不仅限于大麻、可卡因、海洛因等），可能被校长开除出\n校或学区。","修正。”\n武器是指任何可以造成人身伤害的物品，例如，枪支、木棒、铜环、刀、子\n弹，或工具均属于违禁武器。因此，如果教职工确实亲眼目睹学生携带、出售或转\n让武器，应立即向学校管理人员报告。","学生管理人员应确定是否有足够的证据，如果证据充分，应提交一份报告纪\n律，并通知警方少年犯罪部门。校长咨询警方后将决定是否对学生提出法律\n控诉。\n\n所有没收的违禁武器将移交给警察局。\n\n规章 2.3：不准扰乱学校正常秩序","A.藏有：教工或学生如有可据理由怀疑学生藏有毒品或酒精应向学校管理人员报\n告。学生管理人员将就此展开调查，并可以请求警方参与；适当情况下，应采取以\n下步骤：\n违禁 #1：通知学生父母或监护人，举行校纪聆讯，处以学生至少五天停学\n处罚。学生须接受强制的毒品教育和咨询辅导。学生还可能被剥夺参与学\n校课外活动的权利，禁止进入校园，甚至被校长开除学籍。"],"ground_truth":"校长可能会将该生开除出学校或学区。如果校长决定给予停学而非开除，必须向学监提交一份书面说明。"}
{"question":"学校管理人员在搜查学生的身体或储物柜时，必须满足哪些最高法院规定的标准？","answer":"不知道","contexts":["中小学校长、校长助理如对学生的身体、储物柜或财产进行搜查：","(b) 搜查程度必须与搜查目标匹配，不能超出该违纪行为的本质，不能超出学                                                                                                                                                     \n                                 生年龄和性别的适度范围，且必须在另一位学校管理人员的监察下执行。\n\n2.   搜查储物柜：","(b) 禁止大范围搜查储物柜，除非校长或他/她指定的人员认为学校存在安全                                                                                                                                                     \n                                 威胁。\n\n(c) 警察如携带有效搜查令，可在任何时间搜查储物柜。","A.藏有：教工或学生如有可据理由怀疑学生藏有毒品或酒精应向学校管理人员报\n告。学生管理人员将就此展开调查，并可以请求警方参与；适当情况下，应采取以\n下步骤：\n违禁 #1：通知学生父母或监护人，举行校纪聆讯，处以学生至少五天停学\n处罚。学生须接受强制的毒品教育和咨询辅导。学生还可能被剥夺参与学\n校课外活动的权利，禁止进入校园，甚至被校长开除学籍。","A.藏有：教工或学生如有可据理由怀疑学生藏有毒品或酒精应向学校管理人员报\n告。学生管理人员将就此展开调查，并可以请求警方参与；适当情况下，应采取以\n下步骤："],"ground_truth":"必须出示合理的理由怀疑学生违规或藏有违禁品，搜查程度必须与搜查目标匹配，不能超出适度范围，且必须在另一位学校管理人员的监察下执行。"}
{"question":"警察在什么前提下可以在任何时间搜查学校的储物柜？","answer":"警察如携带有效搜查令，可在任何时间搜查储物柜。","contexts":["(b) 禁止大范围搜查储物柜，除非校长或他/她指定的人员认为学校存在安全                                                                                                                                                     \n                                 威胁。\n\n(c) 警察如携带有效搜查令，可在任何时间搜查储物柜。","(a) 储物柜为布鲁克莱恩公立学校所有财产，学校教职工可在任何时间对其进                                                                                                                                                     \n                                 行检查。","(b) 搜查程度必须与搜查目标匹配，不能超出该违纪行为的本质，不能超出学                                                                                                                                                     \n                                 生年龄和性别的适度范围，且必须在另一位学校管理人员的监察下执行。\n\n2.   搜查储物柜：","我们对你的建议是：任何你不愿学校管理人员或警察知道的东西，都不要带任                                                                                                                                                        \n                      何东西到学校，更不要在储物柜中存放。\n\nII.C.  学校委员会对特殊教育计划（IEP's）学生的纪律规定","中小学校长、校长助理如对学生的身体、储物柜或财产进行搜查："],"ground_truth":"警察如携带有效搜查令，可在任何时间搜查储物柜。"}
{"question":"如果特殊需求学生在一个学年内的累积停学时间达到或超过10天，学校的第一步法定程序是什么？","answer":"根据美国残疾儿童教育法案规定，在 1988 年 Honig v.Doe 的案件中，美国最高法院裁决学生在一个学年的停学时间总数累计如达到或超过十天，则构成更换安置地点的条件。","contexts":["b)  如特殊需求学生一个学年内的停学时间累计不超过                                              10  天，则\n根据学校委员会“纪律守则规章”第 A 节第 4 条款和上述第 3\n条规定，该生可立即被实行停学处理。","4.  该生的停学次数及停学时间应记录并保存到该生的特殊教育计划文                                                                                                                                               \n                                          件中，直到下一期特殊教育计划开始执行。\n\n4.   如特殊教育学生一学年里的累积停学时间达到或超过十天，则执行以下政策：","根据美国残疾儿童教育法案规定，在 1988 年 Honig v.Doe 的案件中，美国最高\n法院裁决学生在一个学年的停学时间总数累计如达到或超过十天，则构成更换\n安置地点的条件。[参阅                      Honig v.Doe 108 S.Ct582（1988）]。因此，该类停学\n需要遵守以下程序：","c)  如立即停学处理可能导致学生一个学年内停学时间累计超过\n10  天，则该生不可被停学，除非学校领导得到该生家长同\n意，或该生家长/监护人不同意时，学校接到法院命令同意该\n停学处理。","a.  学校委员会《 纪律守则规章》第 A 节第 3 条规定的所有学生停学程序同样                                                                                                                                                \n                                 适用于特殊需求学生。"],"ground_truth":"学生服务中心副学监或指定人员必须召集复审团队复审该生的特殊教育计划，并书面通知该生家长或监护人,。"}
{"question":"若复审团队判定特殊需求学生的违纪行为与其残疾有关，学校还能否对其执行超过十天的停学处罚？","answer":"不可以","contexts":["与该生的残疾有关；\nii.\n属于该生特殊教育计划不当或安置不当的结果；或\niii.\n属于该生特殊教育计划未得到完全执行的结果\nc.  如复审团队认为该生的行为与上述第 4 节 b 条款所列三个因素中的任一因\n素相关，则不可对该生实行一学年累计十天以上的停学处理，且\ni.    必须对该生的特殊教育计划进行修改，制定出一个更能有效满足\n该生需求的新计划，或如该生的特殊教育计划是恰当的，但该生\n的行为是其特教计划未能完全执行的结果，则学校必须采取所有\n应当采取的措施保证该生的特殊教育计划得到完全执行。","b)  如特殊需求学生一个学年内的停学时间累计不超过                                              10  天，则\n根据学校委员会“纪律守则规章”第 A 节第 4 条款和上述第 3\n条规定，该生可立即被实行停学处理。","d.  如复审团队认为该生的行为与上述第 4 节 b 条款所列三个因素中的任一因\n素均无相关，在符合以下条件的情况下，该生可被处以停学处罚：\ni.     学校遵守学校委员会“纪律守则规章”第                                      A  节第      3  条的程序要\n求，\nii.    该生的特殊教育计划得到修改，以便学生在停学期间也可接受特\n殊教育服务（“替代计划”）。\niii.    替代计划获得特殊教育分部地区办公室批准，并符合教育委员会\n的政策规定；","2.   如特殊需求学生出现违纪行为，学校在按照纪律守则对其采取纪律措施前，应\n通知负责该生教育计划的                        SPED 管理人员，并提交一份“纪律报告”归入该生\n特殊教育计划档案，直到下一特殊教育计划开始执行。","4.  该生的停学次数及停学时间应记录并保存到该生的特殊教育计划文                                                                                                                                               \n                                          件中，直到下一期特殊教育计划开始执行。\n\n4.   如特殊教育学生一学年里的累积停学时间达到或超过十天，则执行以下政策："],"ground_truth":"不可对该生实行一学年累计十天以上的停学处理，并且必须对该生的特殊教育计划进行修改或确保原计划得到完全执行。"}
{"question":"当特殊需求学生出现“危险性的攻击或自虐行为”时，应急评估和安置要求必须取得谁的同意？","answer":"必须取得家长的同意。","contexts":["592  (1988)]\n之标准。\na)  如学生出现“危险性的攻击或自虐行为”，马萨诸塞州普通法\n第    71B   章和《残疾个体教育法》规定了相关应急评估和安置\n地点条款，这些条款均要求取得家长同意。","2.   如特殊需求学生出现违纪行为，学校在按照纪律守则对其采取纪律措施前，应\n通知负责该生教育计划的                        SPED 管理人员，并提交一份“纪律报告”归入该生\n特殊教育计划档案，直到下一特殊教育计划开始执行。","iii.    出现争议时，学生应继续待在之前的安置地点，直到新的安置地\n点按照第 4 节 C（2）条款规定得到批准；或直到学校委员会按照\n下述     D（5）条款规定，接到了法院要求更换学生安置地点的命\n令。","[--- 以下为文件第 7 页内容 ---]\nii.    家长/监护人必须同意新的特殊教育计划，或各方必须寻求解决争\n议的方案，或必须遵守马萨诸塞州第                                    71B   第    401.0   规定的程序\n（学校委员会或家长或监护人可要求在特殊教育申诉局决定特殊\n教育计划的恰当性前举行聆讯）。","c.  如无需修改纪律守则，特殊需求学生应遵守他/她所在学校制定的纪律守                                                                                                                                                     \n                                 则。"],"ground_truth":"要求取得家长同意。"}
{"question":"对于一年期的课程，学生最多可以缺勤多少次而不影响获得学分？","answer":"对学生来说是21次。","contexts":["1.  缺勤总次数上限（有理由和/或无理由）\n布鲁克莱恩高中希望学生正常上课和出勤。学校课业学分包括作业评级和\n学习社区参与度。对一年期的课程，学生最多只能缺勤 21 次（占每个课\n程 140 以上天数的 15%），一学期的课程最多缺勤 11 次，两天/周的学期\n课程最多缺勤 6 次。任何缺勤总次数超过该上线的课程将没有学分。达不\n到上述出勤标准的学生，其成绩单上的最终评级将为“N”。","a.  所有缺勤，无论有无理由，都将记入缺勤总次数上限。以下情况除                                                                                                                                                 \n                                        外：宗教节日、马萨诸塞州综合评估系统测试（MCAS）、大学先","d.  第 10 次无故擅自缺勤（AWOLs）：课程的期末成绩为“N”。学生\n无上诉权。\ne.  由 3 次无故缺勤导致期末成绩为“N”的学期课程，可以视出勤改进\n计划和学生上诉情况最终确定。第 5 次无故缺勤之后，学生无上诉权\n利。","a.\n首次及其后的无故擅自缺勤（AWOLs）：教师告知学生，无理由缺\n席当天学生所得的作业分数最多不超过总分的一半，包括大小测验的\n成绩。\nb.   1 次以上、5 次以下无故擅自缺勤（AWOLs）：教师和院长按纪律条\n例视情节给予学生处分，其中可能包括与家长沟通，课后留堂，禁止\n进入 X 活动区（X-block），直至停学和留级。","由 3 次无故缺勤导致期末成绩为“N”的学期课程，可以视出勤改进\n计划和学生上诉情况最终确定。第 5 次无故缺勤之后，学生无上诉权\n利。\n\n5.  缺勤通知\n\na.  学校给家长发送自动电话讯息，告知学生无故缺勤的日期。电话讯息                                                                                                                                                \n                                        仅做告知用途，不用于计算累计缺勤次数。\n\nb.  家长可以通过 X2 门户查看所有的考勤数据。"],"ground_truth":"学生最多只能缺勤21次（占每个课程140以上天数的15%），超过该上限将没有学分。"}
{"question":"哪些特定的缺勤情况是不计入缺勤总次数上限的？","answer":"宗教节日、马萨诸塞州综合评估系统测试（MCAS）、大学先","contexts":["a.  所有缺勤，无论有无理由，都将记入缺勤总次数上限。以下情况除                                                                                                                                                 \n                                        外：宗教节日、马萨诸塞州综合评估系统测试（MCAS）、大学先","b.  学生如因突发卫生事件时间或住院时间延长而缺勤，可与教务长商\n议，教务长与校长讨论决定是否将该生的缺勤记入缺勤总次数上\n限。","b.\n\n学生如因突发卫生事件时间或住院时间延长而缺勤，可与教务长商\n议，教务长与校长讨论决定是否将该生的缺勤记入缺勤总次数上\n限。\n\n2.  申请缺勤","b.\n学生如因突发卫生事件时间或住院时间延长而缺勤，可与教务长商\n议，教务长与校长讨论决定是否将该生的缺勤记入缺勤总次数上\n限。\n2.  申请缺勤\na.  家长/监护人必须在学生缺勤当天早上 10 点前联系教务长秘书，以\n便确保缺勤记录准确并有效安排后续的补课。任何时间均可在每个\n教务长/项目协调员办公室留言，以辅助缺勤报告。如缺勤申请在\n当天早上 10 点以后，该缺勤将被记录为无理由缺勤。\n   如家长错过了缺勤当天早上 10 点前这一截止时间，应最迟\n在三个上课日内通过便条、邮件或电话信息告知无理由缺勤\n原因。\n   三个工作日后，无理由缺勤将不再有机会转为有理由缺勤。","c.\n如学生错收到无理由缺勤通知，应立即找到教师更正。\n3.  迟到\n如上课开始后学生迟到 20 分钟或 20 分钟以上，则该生该课程记录将被标\n为迟到/缺勤。学生应当继续坐在教室听讲，同时也能补上丢下的功课。\n教师可为迟到学生安排补习时间，并将该生的课程记录从迟到/缺勤改为\n迟到/出勤。迟到/缺勤记入缺勤总次数上限。"],"ground_truth":"包括宗教节日、MCAS测试、A.P.考试、特殊教育考试和会议、前往中国交换学习或停学等。"}
{"question":"家长如果为学生申请缺勤，必须在什么时间点之前联系教务长秘书？错过该时间有何后果？","answer":"家长如果为学生申请缺勤，必须在学生缺勤当天早上10点前联系教务长秘书。错过该时间为无理由缺勤。","contexts":["b.\n学生如因突发卫生事件时间或住院时间延长而缺勤，可与教务长商\n议，教务长与校长讨论决定是否将该生的缺勤记入缺勤总次数上\n限。\n2.  申请缺勤\na.  家长/监护人必须在学生缺勤当天早上 10 点前联系教务长秘书，以\n便确保缺勤记录准确并有效安排后续的补课。任何时间均可在每个\n教务长/项目协调员办公室留言，以辅助缺勤报告。如缺勤申请在\n当天早上 10 点以后，该缺勤将被记录为无理由缺勤。\n   如家长错过了缺勤当天早上 10 点前这一截止时间，应最迟\n在三个上课日内通过便条、邮件或电话信息告知无理由缺勤\n原因。\n   三个工作日后，无理由缺勤将不再有机会转为有理由缺勤。","b.  如学生仍在教学楼内，家长不可为学生请单节课假。学生如离开教\n学楼时间不超过一天（迟到、早退或缺勤半天），则必须电话或便条\n通知教务长秘书，否则该缺勤则为无理由缺勤。家长必须在此类缺勤\n当天结束前阐明理由。","如家长/监护人未告知学校学生的缺勤事由，校长将在学生缺席当日起                                                              3  个工\n作日内通知学生家长或监护人。如果学生一年内无理由缺勤                                                      5  个及以上教学日(每\n个教学日等每门课程当天的                          2  个或以上课时)，校长或校长指定的代理人将会约谈\n该生及该生的家长或监护人。会谈将制定具体措施，以提高学生出勤率。校长或校\n长指定的代理人、学生和学生家长或监护人将共同参与制定相关措施。会议由校长\n或指定人员、学生和学生家长/监护人共同参与。三方可邀请其他相关学校员工和/","b.\n\n学生如因突发卫生事件时间或住院时间延长而缺勤，可与教务长商\n议，教务长与校长讨论决定是否将该生的缺勤记入缺勤总次数上\n限。\n\n2.  申请缺勤","b.  学生如因突发卫生事件时间或住院时间延长而缺勤，可与教务长商\n议，教务长与校长讨论决定是否将该生的缺勤记入缺勤总次数上\n限。"],"ground_truth":"必须在学生缺勤当天早上10点前联系。如果在10点以后申请，该缺勤将被记录为无理由缺勤（事后三个上课日内可补说明理由）。"}
{"question":"学生上课迟到达到或超过多少分钟，该课程记录将被标记为“迟到/缺勤”？","answer":"学生上课迟到达到或超过20分钟，该课程记录将被标记为“迟到/缺勤”。","contexts":["c.\n如学生错收到无理由缺勤通知，应立即找到教师更正。\n3.  迟到\n如上课开始后学生迟到 20 分钟或 20 分钟以上，则该生该课程记录将被标\n为迟到/缺勤。学生应当继续坐在教室听讲，同时也能补上丢下的功课。\n教师可为迟到学生安排补习时间，并将该生的课程记录从迟到/缺勤改为\n迟到/出勤。迟到/缺勤记入缺勤总次数上限。","b.\n学生如因突发卫生事件时间或住院时间延长而缺勤，可与教务长商\n议，教务长与校长讨论决定是否将该生的缺勤记入缺勤总次数上\n限。\n2.  申请缺勤\na.  家长/监护人必须在学生缺勤当天早上 10 点前联系教务长秘书，以\n便确保缺勤记录准确并有效安排后续的补课。任何时间均可在每个\n教务长/项目协调员办公室留言，以辅助缺勤报告。如缺勤申请在\n当天早上 10 点以后，该缺勤将被记录为无理由缺勤。\n   如家长错过了缺勤当天早上 10 点前这一截止时间，应最迟\n在三个上课日内通过便条、邮件或电话信息告知无理由缺勤\n原因。\n   三个工作日后，无理由缺勤将不再有机会转为有理由缺勤。","b.  学生如因突发卫生事件时间或住院时间延长而缺勤，可与教务长商\n议，教务长与校长讨论决定是否将该生的缺勤记入缺勤总次数上\n限。","b.  如学生仍在教学楼内，家长不可为学生请单节课假。学生如离开教\n学楼时间不超过一天（迟到、早退或缺勤半天），则必须电话或便条\n通知教务长秘书，否则该缺勤则为无理由缺勤。家长必须在此类缺勤\n当天结束前阐明理由。","或相关部门（如公共安全部、医疗卫生服务部、住房及非营利机构等）工作人员参\n与。如学生尚未毕业且连续缺勤                              10  天，学生将会有一次离校谈话，以便学生选择\n另类教育或其他教育方式。"],"ground_truth":"迟到20分钟或20分钟以上。"}
{"question":"当学生在某门课程中出现第6次“无故擅自缺勤（AWOLs）”时，会有什么惩罚？","answer":"课程成绩判定为“N”。征询教師意见。制定考勤改进计划，如果学生随后达到出勤改进计划的要求，在课程结束时，学生可以就本课程的“N”成绩上诉，且能够得到学校的支持。在考勤改进计划实施期间，之前及其后的无故擅自缺勤记录将累积计算（错误记录除外）。","contexts":["[--- 以下为文件第 11 页内容 ---]\nc.  第 6 次无故擅自缺勤（AWOLs）：课程成绩判定为“N”。征询教\n师意见。制定考勤改进计划，如果学生随后达到出勤改进计划的要\n求，在课程结束时，学生可以就本课程的“N”成绩上诉，且能够得\n到学校的支持。在考勤改进计划实施期间，之前及其后的无故擅自缺\n勤记录将累积计算（错误记录除外）。","a.\n首次及其后的无故擅自缺勤（AWOLs）：教师告知学生，无理由缺\n席当天学生所得的作业分数最多不超过总分的一半，包括大小测验的\n成绩。\nb.   1 次以上、5 次以下无故擅自缺勤（AWOLs）：教师和院长按纪律条\n例视情节给予学生处分，其中可能包括与家长沟通，课后留堂，禁止\n进入 X 活动区（X-block），直至停学和留级。","d.  第 10 次无故擅自缺勤（AWOLs）：课程的期末成绩为“N”。学生\n无上诉权。\ne.  由 3 次无故缺勤导致期末成绩为“N”的学期课程，可以视出勤改进\n计划和学生上诉情况最终确定。第 5 次无故缺勤之后，学生无上诉权\n利。","a.   首次及其后的无故擅自缺勤（AWOLs）：教师告知学生，无理由缺\n席当天学生所得的作业分数最多不超过总分的一半，包括大小测验的\n成绩。","家长可以通过 X2 门户查看所有的考勤数据。\nc.  成绩报告上的“Q”是一个警告，提醒学生和家长学生存在出勤问\n题。\n   季度：每门课程每季度 6 次级以上总缺勤或 2 次无故缺勤\n（AWOLs），将会导致成绩报告上出现“Q”成绩状态。\n   年度：每门课程年度 12 次及以上总缺勤或 4 次无故缺勤\n（AWOLs），将会导致成绩报告上出现“Q”成绩状态。\n   季度内出现“Q”成绩状态的学生需要面见他们的院长/项目\n协调员，商讨必要的措施和保障提高出勤率。会议的结果将\n会通知学生家长。\n6.  成绩单\n学生正式成绩单上只出现“N”标记。季度的“Q”标记只出现在成绩报告\n卡上。"],"ground_truth":"该课程成绩会被判定为“N”，并需要制定考勤改进计划。"}
{"question":"成绩报告单上如果出现“Q”标记，它代表什么含义？","answer":"季度内出现“Q”成绩状态的学生需要面见他们的院长/项目协调员，商讨必要的措施和保障提高出勤率。会议的结果将会通知学生家长。","contexts":["家长可以通过 X2 门户查看所有的考勤数据。\nc.  成绩报告上的“Q”是一个警告，提醒学生和家长学生存在出勤问\n题。\n   季度：每门课程每季度 6 次级以上总缺勤或 2 次无故缺勤\n（AWOLs），将会导致成绩报告上出现“Q”成绩状态。\n   年度：每门课程年度 12 次及以上总缺勤或 4 次无故缺勤\n（AWOLs），将会导致成绩报告上出现“Q”成绩状态。\n   季度内出现“Q”成绩状态的学生需要面见他们的院长/项目\n协调员，商讨必要的措施和保障提高出勤率。会议的结果将\n会通知学生家长。\n6.  成绩单\n学生正式成绩单上只出现“N”标记。季度的“Q”标记只出现在成绩报告\n卡上。","a.\n首次及其后的无故擅自缺勤（AWOLs）：教师告知学生，无理由缺\n席当天学生所得的作业分数最多不超过总分的一半，包括大小测验的\n成绩。\nb.   1 次以上、5 次以下无故擅自缺勤（AWOLs）：教师和院长按纪律条\n例视情节给予学生处分，其中可能包括与家长沟通，课后留堂，禁止\n进入 X 活动区（X-block），直至停学和留级。","a.   首次及其后的无故擅自缺勤（AWOLs）：教师告知学生，无理由缺\n席当天学生所得的作业分数最多不超过总分的一半，包括大小测验的\n成绩。","c.\n如学生错收到无理由缺勤通知，应立即找到教师更正。\n3.  迟到\n如上课开始后学生迟到 20 分钟或 20 分钟以上，则该生该课程记录将被标\n为迟到/缺勤。学生应当继续坐在教室听讲，同时也能补上丢下的功课。\n教师可为迟到学生安排补习时间，并将该生的课程记录从迟到/缺勤改为\n迟到/出勤。迟到/缺勤记入缺勤总次数上限。","违规 #3：教师尽可能单独告知学生其违规。父母被告知学生的违规行\n为，并可能召开会议，教师、学生、父母、管理员、顾问及系主任均可\n能参会。学生有违规行为的课程，该学期成绩为不合格。管理员将学生\n的违规行为记录在案。"],"ground_truth":"“Q”是一个警告，提醒学生和家长该学生存在出勤问题。"}
{"question":"学生如果因为出勤问题得“N”，在满足什么条件时可以通过参加暑期学校补回学分？","answer":"学生如果某门课得了“N”，在某些情况下，可以通过暑假学校补课，前提\r\n是学生累计缺勤不超过 35 次(总课时的 25%，非满学期的课程按照学分折\r\n算)。","contexts":["7.  弥补措施\n学生如果某门课得了“N”，在某些情况下，可以通过暑假学校补课，前提\n是学生累计缺勤不超过 35 次(总课时的 25%，非满学期的课程按照学分折\n算)。缺勤超过总课时 25%之后，学生没有资格参加暑期学校“补回”该课\n程的学分。学生在这种情况下只有参加暑期学校完整修读该课程的全部原定\n学分，或在下一年重新修读这门课程。(请注意：BHS 暑期学校不开设“全\n部原定学分”的英语课程。）\n8.   上诉\n如果一个学生成功履行了其出勤改进计划，学生可通过院长请求校长考虑删","由 3 次无故缺勤导致期末成绩为“N”的学期课程，可以视出勤改进\n计划和学生上诉情况最终确定。第 5 次无故缺勤之后，学生无上诉权\n利。\n\n5.  缺勤通知\n\na.  学校给家长发送自动电话讯息，告知学生无故缺勤的日期。电话讯息                                                                                                                                                \n                                        仅做告知用途，不用于计算累计缺勤次数。\n\nb.  家长可以通过 X2 门户查看所有的考勤数据。","[--- 以下为文件第 11 页内容 ---]\nc.  第 6 次无故擅自缺勤（AWOLs）：课程成绩判定为“N”。征询教\n师意见。制定考勤改进计划，如果学生随后达到出勤改进计划的要\n求，在课程结束时，学生可以就本课程的“N”成绩上诉，且能够得\n到学校的支持。在考勤改进计划实施期间，之前及其后的无故擅自缺\n勤记录将累积计算（错误记录除外）。","d.  第 10 次无故擅自缺勤（AWOLs）：课程的期末成绩为“N”。学生\n无上诉权。\ne.  由 3 次无故缺勤导致期末成绩为“N”的学期课程，可以视出勤改进\n计划和学生上诉情况最终确定。第 5 次无故缺勤之后，学生无上诉权\n利。","1.  缺勤总次数上限（有理由和/或无理由）\n布鲁克莱恩高中希望学生正常上课和出勤。学校课业学分包括作业评级和\n学习社区参与度。对一年期的课程，学生最多只能缺勤 21 次（占每个课\n程 140 以上天数的 15%），一学期的课程最多缺勤 11 次，两天/周的学期\n课程最多缺勤 6 次。任何缺勤总次数超过该上线的课程将没有学分。达不\n到上述出勤标准的学生，其成绩单上的最终评级将为“N”。"],"ground_truth":"前提是学生累计缺勤不超过35次（总课时的25%）。"}
{"question":"学校在何种范围或活动内发生的“授权报告事件”必须立即向警方报告？","answer":"学校财产范围内；学校财产 1000 英尺半径范围内；学校资助的活动上；学校所有或学校合同签有的交通工具内。","contexts":["下列授权报告事件发生时，授权报告机构将立即向指定的联络警方报告：\n    学校财产范围内\n    学校财产 1000 英尺半径范围内\n    学校资助的活动上\n    学校所有或学校合同签有的交通工具内","    任何涉及或涉嫌犯下仇恨罪行或侵犯公民权利的事件\n    任何纵火事件或威胁，或涉及燃烧装置或爆炸物的事件\n\n所有员工都将遵守学校的建筑设施范围内标准应对措施方案，及时报告上述事                                                                                                                                                        \n                      件。","授权报告事件列表\n    任何有合理根据怀疑或判定任何个人拥有、销售或分发马萨诸塞州普通\n法第 94 章规定的酒类、吸入剂或任何管制物品的事件\n    除意外事故之外，任何导致严重人身伤害或重大财产损坏或损失的事\n件，或存在此类威胁的活动\n    任何个人拥有马萨诸塞州普通法第                                269  章第      10  节规定的枪械或危险武\n器，或用其进行威胁，或拥有其他能够造成混乱、警报、伤害或破坏学\n校社区整体福利的物品\n    任何性侵犯和强奸；不友好的搭讪或侮辱行为；令人恼怒或严重的人身\n骚扰，包括但不仅限于：种族、性别、民族血统、宗教、残疾或性倾向\n骚扰等\n    任何涉及家庭暴力、虐待、约会暴力，或违反马萨诸塞州普通法第\n209A 章限令的事件\n    任何涉及身体虐待或性虐待儿童的事件","[--- 以下为文件第 14 页内容 ---]\nC.出售或转让：教工或学生如有可据理由认为发现了违禁品出售或转让行为，应立\n即向学校管理人员或安保人员报告。涉事学生将被要求把违禁品交给管理员。学生\n管理人员将召开纪律聆讯。根据第二章 B 款的规定，学生有可能被搜查。","B.使用（出现吸毒或饮酒状态）：教工或学生如有可据理由怀疑学生表现出吸毒或\n饮酒状态应向学校管理人员报告。学生管理人员将就此展开调查，在适当情况下，\n应采取以下步骤："],"ground_truth":"学校财产范围内、学校财产1000英尺半径范围内、学校资助的活动上、以及学校所有或合同签有的交通工具内。"}
{"question":"如果教工发现学生表现出吸毒或饮酒状态（使用状态的首次违禁），学生将面临至少多少天的停学？","answer":"10 天以下停学，学生须接受辅导，校长召开由学生、学生家长或监护人以及校管理人员共同参加的聆讯，并视情节决定采取渐进的纪律措施。","contexts":["A.藏有：教工或学生如有可据理由怀疑学生藏有毒品或酒精应向学校管理人员报\n告。学生管理人员将就此展开调查，并可以请求警方参与；适当情况下，应采取以\n下步骤：\n违禁 #1：通知学生父母或监护人，举行校纪聆讯，处以学生至少五天停学\n处罚。学生须接受强制的毒品教育和咨询辅导。学生还可能被剥夺参与学\n校课外活动的权利，禁止进入校园，甚至被校长开除学籍。","违禁 #1：通知学生家长或监护人，并让他们安排把学生从护士办公室带回\n家。学生必须有人监看，直至学生进入管理人员、家长/监护人的会谈现\n场。举行校纪聆讯，学生将被处以停学至少三天的处罚。学生须接受强制\n毒品教育和咨询辅导。学生还可能被剥夺参与学校课外活动的权利，禁止进\n入校园，甚至被校长开除学籍。","B.使用（出现吸毒或饮酒状态）：教工或学生如有可据理由怀疑学生表现出吸毒或\n饮酒状态应向学校管理人员报告。学生管理人员将就此展开调查，在适当情况下，\n应采取以下步骤：","违禁     #2：执行上述违禁#1 的所有处分，并处以 10 天以下停学，学生须接受\n辅导，校长召开由学生、学生家长或监护人以及校管理人员共同参加的聆\n讯，并视情节决定采取渐进的纪律措施。","违禁 #1：管理人员召集家长或监护人，并给予警告，同时将违规行为\n按照严重程度分为“A”“B”“C”和“F”四等，然后决定是否需要\n警方立即介入。\n违禁 #2：管理人员举行由涉事学生及家长或监护人参加的校纪聆讯，\n如果事出有因，要求涉事学生就所犯违禁事项撰写研究报告或其他研究\n性质的书面作业；此种作业如未能按时完成，学生将立即被处以两天的\n停学处罚。必要时可要求学生参加相关行为的咨询辅导。"],"ground_truth":"学生将被处以至少三天的停学处罚，并须接受强制毒品教育和咨询辅导。"}
{"question":"根据MIAA政策，运动员首次违反化学药品卫生政策，将被取消多少比例的比赛资格？","answer":"25%","contexts":["[--- 以下为文件第 15 页内容 ---]\nMIAA 学生运动员化学药品卫生政策追加处罚：\n1.   首次违禁：运动员主任，或由校长或校长指定负责人召开的校纪聆讯，如果确\n定某一学生存在违禁事实，该生将失去参加此后系列校际比赛的资格，占该运\n动校际比赛总场次的                    25%（见       MIAA 手册，2005 年               7 月    1 日）。任何被医治\n项目收治的学生均不得例外。为辅助康复，建议可以让学生继续保持练习。","2.   第二次及之后的违禁：运动员主任，或由校长或校长指定负责人召开的校纪聆\n讯，如果确定某一学生存在违禁事实，该生将失去参加此后系列校际比赛的资\n格，占该运动校际比赛总场次的 60%。第二次及以上违禁后，学生如自愿加入\n获得学校批准认可的治疗方案，则学生可能有机会在赛事结束 40%之后重新取\n得参赛资格。","[--- 以下为文件第 15 页内容 ---]\n\nMIAA 学生运动员化学药品卫生政策追加处罚：","学年期间，从              8 月份的季前赛运动和/或演艺表演，到学期或联谊比赛的最后\n一天，以一切学校活动最晚的截止日期为准，布鲁克林高学生一律不得使用或消\n费、购买、出售或赠予任何酒精、大麻、类固醇或任何受控物品，无论数量如何。\n学生亦不得围观他人使用或消费上述受控物品。学生拥有依据特定处方购买的自\n用合法药品不算违禁。根据这项政策，运动员禁止使用烟草和无烟烟草。","违规情况#1：布鲁克莱恩警方报告学生违反药品卫生管理制度后，该生姓\n名将被提交给表演系主任和教职员工。主任和教职员工将采取下列惩处措\n施：涉事学生必须参加注意力转移项目，接受毒品教育，以使他们能成功回\n归表演系的角色中。此外，学生还将被罚以以下惩处：\n1.)如学生目前正在参加任何课外表演作品的试镜，她/他将失去参加该作品\n下一次演出的资格。"],"ground_truth":"将失去参加此后系列校际比赛的资格，占该运动校际比赛总场次的25%。"}
{"question":"学校对于“抄袭”的定义具体包含哪些行为？","answer":"抄袭是指引用他人语句、数据、创意或观点，未在脚注或参考文献中注明的行为。该行为包括原文引用、释义、改写，以及提交非本人完成的作业。","contexts":["抄袭\n抄袭是指引用他人语句、数据、创意或观点，未在脚注或参考文献中注明的行\n为。该行为包括原文引用、释义、改写，以及提交非本人完成的作业。\n作弊和抄袭处理制度：\n授课教师将会纠察日常家庭作业中的作弊和抄袭行为。其他所有作业同样适用\n该制度；任何申请学分的作业或作品，包括草稿和提纲，亦适用该制度。学生的作\n弊行为将被记入学生档案，并保存在管理员办公室。违规行为实行跨学科累积。例\n如，如果某学生二年级时在物理科目中作弊，后在三年级英语科目中抄袭，则该生\n违规两次。","抄袭\n抄袭是指引用他人语句、数据、创意或观点，未在脚注或参考文献中注明的行\n为。该行为包括原文引用、释义、改写，以及提交非本人完成的作业。","[--- 以下为文件第 17 页内容 ---]\n作弊和抄袭之定义\n作弊\n作弊是指未经允许，拥有、传递、共享、获取或展示对学生有利的信息或材\n料。\n作弊行为包括但不限于：考试期间以任何方式传递信息，考试期间拥有或使用\n任何未经允许的材料或科技产品，在班级间传递考试相关的信息，以及提交非本人\n完成的作业。","任何扰乱班级、图书馆或学校其他活动的行为都属于扰乱学校正常秩序行为，\n具体包括：挡住出入口、妨碍出入、外放收音机、大呼小叫、玩滑板、拍球、在学\n校建筑物内骑自行车或滑旱冰（溜冰）、打雪仗或丢水球、携带或使用水枪以及其\n他各种扰乱学校正常活动等行为。","学生如作弊或抄袭，则不得参选国家荣誉生，并可能无法获得有品德要求的奖                                                                                                                                                        \n                      学金。"],"ground_truth":"抄袭是指引用他人语句、数据、创意或观点，未在脚注或参考文献中注明的行为，包括原文引用、释义、改写，以及提交非本人完成的作业。"}
{"question":"如果学生第二次被发现作弊或抄袭，除本次作业零分外，季度平均成绩如何处理？","answer":"学生本次作业按零分处理；计算季度平均成绩时，与作弊作业等值的成绩也按零分计算。","contexts":["违禁 #2：教师尽可能单独告知学生其违规。父母被告知学生的违规行\n为，并可能召开会议，教师、学生、父母、管理员、顾问及系主任均可\n能参会。学生本次作业按零分处理；计算季度平均成绩时，与作弊作业\n等值的成绩也按零分计。管理员将学生的违规行为记录在案。","学生如作弊或抄袭，则不得参选国家荣誉生，并可能无法获得有品德要求的奖                                                                                                                                                        \n                      学金。","抄袭\n抄袭是指引用他人语句、数据、创意或观点，未在脚注或参考文献中注明的行\n为。该行为包括原文引用、释义、改写，以及提交非本人完成的作业。\n作弊和抄袭处理制度：\n授课教师将会纠察日常家庭作业中的作弊和抄袭行为。其他所有作业同样适用\n该制度；任何申请学分的作业或作品，包括草稿和提纲，亦适用该制度。学生的作\n弊行为将被记入学生档案，并保存在管理员办公室。违规行为实行跨学科累积。例\n如，如果某学生二年级时在物理科目中作弊，后在三年级英语科目中抄袭，则该生\n违规两次。","各系在每学年伊始都在特殊纪律中说明作弊和抄袭问题。新生将会由一名管理\n人员当面告知相关事项，确保学生理解相关制度。最后，国际学生辅导员将与学\n生、教师、管理员合作，向来自不同文化的学生解释这些内容。","违禁 #1：教师尽可能单独告知学生其违规。父母被告知学生的违规行\n为，并可能召开会议，教师、学生、父母、管理员、顾问及系主任均可\n能参会。学生本次作业作零分处理。管理员将学生的违规行为记录在\n案。"],"ground_truth":"计算季度平均成绩时，与作弊作业等值的成绩也按零分计。"}
{"question":"在SMARTS个人电子设备使用制度中，“R（礼貌）”代表什么要求？","answer":"学生使用科技产品时必须有礼貌","contexts":["科技产品和个人电子设备的使用是学生的权利，但不得破坏学校秩序或影响课                                                                                                                                                        \n                      堂学习。因此，为遵守有礼貌使用科技产品的规定，学校设有以下限制：","教室电子产品使用：每位教师对科技产品的使用规定将作为教学大纲或课程规划\n的一部分，以书面形式告知学生。此外，SMARTS                                            政策规定宣传画应在每个教室\n的显眼处展示。","S（学生）：            学生在布鲁克莱恩高中可以使用科技产品\nM（习惯）：布鲁克莱恩高中的毕业生将具有良好的科技产品使用习惯。\nA（助人）：            学生应乐于帮助他人\nR（礼貌）：            学生使用科技产品时必须有礼貌\nT（教师）：            教师决定在其课堂中科技产品能否使用以及使用方式\nS（静音）： 使用所有科技产品必须静音","[--- 以下为文件第 18 页内容 ---]\n规章 1.4：个人电子设备使用制度\n布鲁克莱恩高中认识到了当今世界科技的广泛应用。然而我们的校园文化建设\n同时也高度重视人际互动，重视现实生活中人与人之间的密切往来。考虑到这两方\n面的现实情况，我们主张 SMARTS 制度：","3            禁闭                     员和学生谈话，制定合理的个人电子设备使用办法，\n告知下一步可能采取的惩罚措施，如没收设备。学生\n限制离校                   被关禁闭，两周不得参加Ｘ区活动。"],"ground_truth":"代表“学生使用科技产品时必须有礼貌”。"}
{"question":"手机通话规定：每天自8:15至教学日结束，学生唯一允许进行手机通话的地点是哪里？","answer":"大门中庭外的门廊。","contexts":["手机：在建筑物中的任何地方，包括院子里，不得使用手机通话。此规定每天自                                                                                                                                                             \n                      8:15 至教学日结束有效。手机通话仅允许在大门中庭外的门廊进行。","耳机：在建筑物内，包括院子中，学生不得（在耳朵或脖子上）戴耳机。只有教\n师或图书馆员允许后，学生才能在教室中使用耳机。此规定每天自                                                            8:15   至教学日\n结束有效。","b.  如学生仍在教学楼内，家长不可为学生请单节课假。学生如离开教\n学楼时间不超过一天（迟到、早退或缺勤半天），则必须电话或便条\n通知教务长秘书，否则该缺勤则为无理由缺勤。家长必须在此类缺勤\n当天结束前阐明理由。","3            禁闭                     员和学生谈话，制定合理的个人电子设备使用办法，\n告知下一步可能采取的惩罚措施，如没收设备。学生\n限制离校                   被关禁闭，两周不得参加Ｘ区活动。","设备                     续违规可能受到的惩罚，包括停学。学生至少一周不\n得在校使用手机，一个月不得参加Ｘ区活动。\n禁止进入校园"],"ground_truth":"手机通话仅允许在大门中庭外的门廊进行。"}
{"question":"电子设备被“立即没收”的情形包括哪些滥用行为？","answer":"电子设备被“立即没收”的情形包括使用科技产品作弊、抄袭或秘密记录他人交流内容。","contexts":["此外，不当或非法使用电子设备将受到学校处罚，并/或移交警方处理。此违\n规情况包括使用电子设备侵犯学生、工作人员或教师的隐私，或涉嫌骚扰或诽谤。\n任何滥用电子设备的行为，包括使用科技产品作弊、抄袭或秘密记录他人交流内\n容，将导致电子设备被立即没收，并可能会引起其他可能的法律惩处和/或学校处\n罚。","3            禁闭                     员和学生谈话，制定合理的个人电子设备使用办法，\n告知下一步可能采取的惩罚措施，如没收设备。学生\n限制离校                   被关禁闭，两周不得参加Ｘ区活动。","设备                     续违规可能受到的惩罚，包括停学。学生至少一周不\n得在校使用手机，一个月不得参加Ｘ区活动。\n禁止进入校园","违禁 #1：赌资及其他相关物品一律没收，并由该生的管理员、家长/监护人                                                                                                                                                    \n                               和[法律]顾问召开会议。\n\n违禁     #2（及后续违禁行为）由该生管理员视情节给出纪律处分。","设备                     续违规可能受到的惩罚，包括停学。学生至少一周不\n得在校使用手机，一个月不得参加Ｘ区活动。\n禁止进入校园\n\n违禁             待定处罚                   教师/工作人员将向系主任秘书提交违规通知。管理\n\n5+                                  员与学生一起制定惩罚措施。"],"ground_truth":"包括使用科技产品作弊、抄袭或秘密记录他人交流内容。"}
{"question":"根据布鲁克莱恩镇控烟条例，学生不得在距离学校建筑物多远范围内吸烟？","answer":"距布鲁克莱恩中学任何建筑物400英尺范围内。","contexts":["自2014年秋季起，按照布鲁克莱恩镇控烟条例第8.23条，学生和学校工作人员                                                                                                                                                    \n                      不得在学校场地及距布鲁克莱恩中学任何建筑物400英尺范围内吸烟。","学年期间，从              8 月份的季前赛运动和/或演艺表演，到学期或联谊比赛的最后\n一天，以一切学校活动最晚的截止日期为准，布鲁克林高学生一律不得使用或消\n费、购买、出售或赠予任何酒精、大麻、类固醇或任何受控物品，无论数量如何。\n学生亦不得围观他人使用或消费上述受控物品。学生拥有依据特定处方购买的自\n用合法药品不算违禁。根据这项政策，运动员禁止使用烟草和无烟烟草。","[--- 以下为文件第 13 页内容 ---]\n规章 1.2：校内或学校举办的活动场所实施毒品及饮酒零容忍政策\n布鲁克莱恩学校认为未成年人拥有和/或使用非法药品/毒品、非法拥有和/或饮\n用酒精饮料，将会严重损害学生的身体和/或情绪状态。因此，布鲁克莱恩高中制\n定了严格的规章，在校内或在学校举办的活动，包括运动会以及非教学日的校外\n社会活动，禁止拥有、出售、转让或使用以上物品。","规章 1.5：禁烟制度\n马萨诸塞州所有中小学生，在正常上课时间内使用任何类型的烟草制品均属于\n违法行为。另外，严禁任何人，包括学校工作人员，在校园建筑、学校设施、学校\n场地和校车内使用任何烟草制品，详见：马萨诸塞州普通法 71 章 2A 款；马萨诸\n塞州普通法 71 章 37H 款；布鲁克莱恩公学规章制度手册，G(1)(c)款。","如学生校外行为违反了下述“学生行为守则”规定，且校长认为该学生的行为\n极大地损害了学校社区的整体福利和安全，布鲁克莱恩高中校领导可对该生采取纪\n律处分。具体处分将按“学生行为守则”的规定执行。"],"ground_truth":"不得在距任何建筑物400英尺范围内吸烟。"}
{"question":"在年中或期末考试中迟到的学生，是否可以延长考试时间？","answer":"该考试科目教师可以批准例外情况，并向学监解释该决定。","contexts":["[--- 以下为文件第 20 页内容 ---]\n\n规章 1.6：年中和期末考试严禁迟到\n\n学生如在年中或期末考试中迟到，不得延长时间完成考试。该考试科目教师                                                                                                                                                      \n                               可以批准例外情况，并向学监解释该决定。\n\n规章 1.7：严禁赌博","b.  学生如因突发卫生事件时间或住院时间延长而缺勤，可与教务长商\n议，教务长与校长讨论决定是否将该生的缺勤记入缺勤总次数上\n限。","4.  该生的停学次数及停学时间应记录并保存到该生的特殊教育计划文                                                                                                                                               \n                                          件中，直到下一期特殊教育计划开始执行。\n\n4.   如特殊教育学生一学年里的累积停学时间达到或超过十天，则执行以下政策：","b.\n学生如因突发卫生事件时间或住院时间延长而缺勤，可与教务长商\n议，教务长与校长讨论决定是否将该生的缺勤记入缺勤总次数上\n限。\n2.  申请缺勤\na.  家长/监护人必须在学生缺勤当天早上 10 点前联系教务长秘书，以\n便确保缺勤记录准确并有效安排后续的补课。任何时间均可在每个\n教务长/项目协调员办公室留言，以辅助缺勤报告。如缺勤申请在\n当天早上 10 点以后，该缺勤将被记录为无理由缺勤。\n   如家长错过了缺勤当天早上 10 点前这一截止时间，应最迟\n在三个上课日内通过便条、邮件或电话信息告知无理由缺勤\n原因。\n   三个工作日后，无理由缺勤将不再有机会转为有理由缺勤。","c.\n如学生错收到无理由缺勤通知，应立即找到教师更正。\n3.  迟到\n如上课开始后学生迟到 20 分钟或 20 分钟以上，则该生该课程记录将被标\n为迟到/缺勤。学生应当继续坐在教室听讲，同时也能补上丢下的功课。\n教师可为迟到学生安排补习时间，并将该生的课程记录从迟到/缺勤改为\n迟到/出勤。迟到/缺勤记入缺勤总次数上限。"],"ground_truth":"不得延长时间完成考试，除非该考试科目教师批准例外情况并向学监解释。"}
{"question":"根据马萨诸塞州法律，非执法人员将枪支带入校园教学楼，将面临什么处罚？","answer":"任何非执法人员携带枪支进入校园教学楼的行为，将被处于1000美元以下的罚款（$1,000）或一年以下的拘留。","contexts":["规章 2.2：枪支武器零容忍政策\n禁止携带任何枪支进入学校建筑物内或校园其他地方\n《马塞诸塞州普通法》第 269 章第 10 节规定：\n（j）“任何非执法人员，即使其获得第                                     140  章（见下文）规定的持枪\n牌照，若将枪支（见下文定义）携带进任何初高中或大学校园的教学楼\n和活动场地，无论枪支有无弹药，携带者均将被处于                                                 1000   美元以下的\n罚款（$1,000）或一年以下的拘留，亦或两罚并处。在本条款中，“枪\n支”包括任何能够发射子弹的普通手枪、左轮手枪、步枪和滑膛枪等。\n第 150 章第 2 节，St.1989 修正。”","规章 2.2：枪支武器零容忍政策\n\n禁止携带任何枪支进入学校建筑物内或校园其他地方\n\n《马塞诸塞州普通法》第 269 章第 10 节规定：","F.   禁止脱下或掀开自己或他人的衣服，依据《马塞诸塞州普通法》，此类\n身体暴露行为亦可构成重罪。\n以下是惩治上诉违规行为的处罚措施；学校管理人员也可以根据具体情况，拥\n有自由裁量权实施相关处罚：","i.  马萨诸塞州普通法第 71 章第 37H½节规定：学生如在学校宿舍、学校活动\n或与学校有关的活动（包括竞技游戏）中被发现携带危险武器（包括但不\n仅限于枪支或刀具）或第                         94  章    C  规定的管制物品（包括但不仅限于大\n麻、可卡因、海洛因等），可能被校长开除出学校或学区。学生如在学校\n宿舍、学校活动或与学校有关的活动（包括竞技游戏）中攻击校长、副校\n长、教师、教师助理或其他教学员工，可能会被校长开除出学校或学区。\n任何被控诉违反(a)或(b)条款的学生会收到一份参加聆讯的书面通知；假\n如该学生准备了自我陈述，该生可在上述聆讯现场向校长出示证据和证\n人。","C.   禁止暴力和恐吓性的身体接触，包括打、压、按、限制或阻挡通行、抢\n夺、扇耳光、强行坐压，以及揪头发。依据《马塞诸塞州普通法》第\n265 章第 13A，上述行为可构成“暴力人身攻击”之重罪。"],"ground_truth":"携带者将被处于1000美元以下的罚款或一年以下的拘留，或两罚并处。"}
{"question":"根据《马萨诸塞州欺凌法案》，校长在接到校园欺凌报告后，必须在多长时间内展开调查并在多长时间内向学监提交书面报告？","answer":"24小时内展开调查，在48小时内向学监提交书面报告。","contexts":["2.  接到报告后，校长将在 24 小时内展开调查。如果调查证实所报告之欺凌\n确实存在，校长将采取法律手段（有必要的话），同时通知所以涉事学\n生的父母或监护人。\n\n3.  在接到报告的 48 小时内，校长将向学监提交关于此事件的书面报告。\n\n4.  在法律允许的范围内，校长会向受害学生的家长或监护人，提供防止欺                                                                                                                                                    \n                                   凌或报复行为再次发生的应对措施等信息。","2.  接到报告后，校长将在 24 小时内展开调查。如果调查证实所报告之欺凌\n确实存在，校长将采取法律手段（有必要的话），同时通知所以涉事学\n生的父母或监护人。","该生有权就停学处罚向学监上诉。该生须在停学处罚生效后的五个日\n历日内以书面形式向学监提交上诉请求。学监须在该生提交上诉请求\n后的三个日历日内为该生及该生家长或监护人举行聆讯。聆讯现场，\n该生有权以自身名义陈述和出示口头和书面证词，有权聘请律师。学","该生有权就开除学籍的处罚向学监上诉。该生须在开除学籍处罚生效\n的五个日历日内以书面形式向学监提交上诉请求。学监须在该生开除\n学籍处罚生效后的三个日历日内为该生及该生家长或监护人举行聆\n讯。聆讯现场，该生有权以自身名义陈述和出示口头和书面证词，有\n权聘请律师。学监有权推翻或更改校长的决定，包括为该生推荐替代\n教育项目。学监须在聆讯后的五个日历日内宣告上诉判决。该判决为\n该生开除学籍处罚在其所在城市、城镇或地区学区的最终结果。","5.   校长与学监商讨后，可对学生处以开除（永久开除学籍）或 10 天以上的停学处\n罚。学生因其所控违纪行为被开除学籍前，校长必须为学生及他/她的家长举行\n公正的校记聆讯（马萨诸塞州普通法第 76 章第 17 节）。学校通知学生及他/她\n的家长聆讯时，必须为学生及他/她的家长提供一份“高中纪律守则”对于开除\n学籍的规定。聆讯时，学生在程序上享有以下权利："],"ground_truth":"校长必须在24小时内展开调查，并在接到报告的48小时内向学监提交书面报告。"}
{"question":"在处理性骚扰投诉时，如果有人故意谎报或捏造骚扰行为，将面临什么后果？","answer":"将会招致停学甚至开除学籍的处分。","contexts":["布鲁克莱恩所有公立学校均致力于消除校园环境内的一切骚扰行为，包括但\n不限于：年龄、肤色、残疾、性别、性别认同、国籍、种族、宗教或性取向。在工\n作场所或学校的上述骚扰行为均构成违法，必须严格禁止。实施骚扰的人员可能涉\n及学校管理人员、本校教员或校外助理、在校学生、学校供应商以及其他校内或校\n外相关人员。此外，对报告骚扰或配合调查骚扰人员的一切报复行为，均属违法行\n为，必须受到严厉惩处。故意谎报、捏造骚扰行为，将会招致停学甚至开除学籍的\n处分。\n在实施以上规定过程中，布鲁克莱恩校委员会：\n1.   并非旨在限制使用诸如艺术书籍、雕塑、文学著作等适宜学术学习的材\n料；也不禁止在上述领域中就有关话题的讨论；","此外，不当或非法使用电子设备将受到学校处罚，并/或移交警方处理。此违\n规情况包括使用电子设备侵犯学生、工作人员或教师的隐私，或涉嫌骚扰或诽谤。\n任何滥用电子设备的行为，包括使用科技产品作弊、抄袭或秘密记录他人交流内\n容，将导致电子设备被立即没收，并可能会引起其他可能的法律惩处和/或学校处\n罚。","2.   指导如何处置和惩罚有关骚扰行为时，考虑涉事学生的具体年龄和实际                                                                                                                                                   \n                                    能力。\n\n3.   督促学监及校委员会对骚扰投诉程序进行定期审查。","B.   禁止性触摸，包括触摸乳房、臀部、胯部、腹部和大腿内侧。依据《马\n塞诸塞州普通法》第                    265 章第      13B，以上触摸行为可构成“猥亵和人身\n伤害”之重罪。","某些骚扰行为还触犯了《马塞诸塞州普通法》中的公民权利。\n违禁 #1：目击骚扰事件的学生、员工，或受害者本人需将此事报告给现场\n最近的校管理人员。管理人员负责通知涉事学生的家长或监护人参加由所有\n违规学生和学校管理人员一同参加的聆讯。如果管理人员认为此骚扰行为涉\n嫌违反《马塞诸塞州普通法》规定的公民权利，那么布鲁克莱恩警方主管少\n年犯罪的警官亦当介入。学生将视情节受到处罚，必要时还可采取法律咨询\n和法律调解。"],"ground_truth":"故意谎报、捏造骚扰行为，将会招致停学甚至开除学籍的处分,。"}
{"question":"根据《马萨诸塞州欺凌法案》，如果学生遭遇网络欺凌，学校必须在接到报告后的几个小时内直接向警方报警？","answer":"不知道","contexts":["2.  接到报告后，校长将在 24 小时内展开调查。如果调查证实所报告之欺凌\n确实存在，校长将采取法律手段（有必要的话），同时通知所以涉事学\n生的父母或监护人。","2.  接到报告后，校长将在 24 小时内展开调查。如果调查证实所报告之欺凌\n确实存在，校长将采取法律手段（有必要的话），同时通知所以涉事学\n生的父母或监护人。\n\n3.  在接到报告的 48 小时内，校长将向学监提交关于此事件的书面报告。\n\n4.  在法律允许的范围内，校长会向受害学生的家长或监护人，提供防止欺                                                                                                                                                    \n                                   凌或报复行为再次发生的应对措施等信息。","学生管理人员应确定是否有足够的证据，如果证据充分，应提交一份报告纪\n律，并通知警方少年犯罪部门。校长咨询警方后将决定是否对学生提出法律\n控诉。\n\n所有没收的违禁武器将移交给警察局。\n\n规章 2.3：不准扰乱学校正常秩序","再犯：停学 3 天并执行违禁#1 的所有处罚措施。\n《马塞诸塞州欺凌法案》：\n2010 年 5 月 3 日，马萨诸塞州州长迪沃·帕特里克签署了《马塞诸塞州普通\n法》第 71 章第 370 条法案《关于校园欺凌行为的法案》。该法要求各校区制定并\n实施制止校园欺凌行为的办法。在布鲁克莱恩高中，为确保每位学生和教职人员的\n安全，我们始终致力于建设和谐安全的校园环境；我们也为自己取得的成绩感到自","某些骚扰行为还触犯了《马塞诸塞州普通法》中的公民权利。\n违禁 #1：目击骚扰事件的学生、员工，或受害者本人需将此事报告给现场\n最近的校管理人员。管理人员负责通知涉事学生的家长或监护人参加由所有\n违规学生和学校管理人员一同参加的聆讯。如果管理人员认为此骚扰行为涉\n嫌违反《马塞诸塞州普通法》规定的公民权利，那么布鲁克莱恩警方主管少\n年犯罪的警官亦当介入。学生将视情节受到处罚，必要时还可采取法律咨询\n和法律调解。"],"ground_truth":"守则中并未规定必须在几小时内“向警方报警”。守则仅规定校长在接到欺凌报告后，必须在24小时内展开调查，并在48小时内向学监提交书面报告，且在有必要时“采取法律手段”。"}
{"question":"在学校走廊上，如果有学生未经允许使用MP3播放器听歌，第一违禁的惩罚是罚款多少美元？","answer":"不知道","contexts":["设备                     续违规可能受到的惩罚，包括停学。学生至少一周不\n得在校使用手机，一个月不得参加Ｘ区活动。\n禁止进入校园","3            禁闭                     员和学生谈话，制定合理的个人电子设备使用办法，\n告知下一步可能采取的惩罚措施，如没收设备。学生\n限制离校                   被关禁闭，两周不得参加Ｘ区活动。","设备                     续违规可能受到的惩罚，包括停学。学生至少一周不\n得在校使用手机，一个月不得参加Ｘ区活动。\n禁止进入校园\n\n违禁             待定处罚                   教师/工作人员将向系主任秘书提交违规通知。管理\n\n5+                                  员与学生一起制定惩罚措施。","A.藏有：教工或学生如有可据理由怀疑学生藏有毒品或酒精应向学校管理人员报\n告。学生管理人员将就此展开调查，并可以请求警方参与；适当情况下，应采取以\n下步骤：\n违禁 #1：通知学生父母或监护人，举行校纪聆讯，处以学生至少五天停学\n处罚。学生须接受强制的毒品教育和咨询辅导。学生还可能被剥夺参与学\n校课外活动的权利，禁止进入校园，甚至被校长开除学籍。","违禁     #2：实施违禁＃1 的全部处罚措施。校长举行校纪聆讯，按纪律条例视                                                                                                                                               \n                               情节给予学生处分，包括开除学籍的处罚。"],"ground_truth":"守则中没有针对电子设备违规进行“罚款”的规定。规章1.4规定电子设备首次违禁的惩罚是：警告，教师/工作人员提交违规通知，管理员记录并与涉事学生谈话。"}
{"question":"如果学生首次在校园内被发现“拥有”毒品，和首次被发现“表现出吸毒状态（使用）”，他们面临的最低停学天数是一样的吗？分别是多少天？","answer":"不一样，都是三天。","contexts":["A.藏有：教工或学生如有可据理由怀疑学生藏有毒品或酒精应向学校管理人员报\n告。学生管理人员将就此展开调查，并可以请求警方参与；适当情况下，应采取以\n下步骤：\n违禁 #1：通知学生父母或监护人，举行校纪聆讯，处以学生至少五天停学\n处罚。学生须接受强制的毒品教育和咨询辅导。学生还可能被剥夺参与学\n校课外活动的权利，禁止进入校园，甚至被校长开除学籍。","b)  如特殊需求学生一个学年内的停学时间累计不超过                                              10  天，则\n根据学校委员会“纪律守则规章”第 A 节第 4 条款和上述第 3\n条规定，该生可立即被实行停学处理。","B.使用（出现吸毒或饮酒状态）：教工或学生如有可据理由怀疑学生表现出吸毒或\n饮酒状态应向学校管理人员报告。学生管理人员将就此展开调查，在适当情况下，\n应采取以下步骤：","规章 2.1：禁止打架和使用暴力\n违禁 #1：学校将立即通知学生家长/监护人，学生处以                                              3 天以下停学。（根\n据程序法规，此类情况应视作“紧急情况”，参见第                                               II 章    A 条款。）学校\n将尽快安排涉事学生、学生父母或监护人以及学校相关管理人员共同参加校\n纪聆讯。调解是必不可少的途径。","违禁 #1：通知学生家长或监护人，并让他们安排把学生从护士办公室带回\n家。学生必须有人监看，直至学生进入管理人员、家长/监护人的会谈现\n场。举行校纪聆讯，学生将被处以停学至少三天的处罚。学生须接受强制\n毒品教育和咨询辅导。学生还可能被剥夺参与学校课外活动的权利，禁止进\n入校园，甚至被校长开除学籍。"],"ground_truth":"不一样。首次“藏有（拥有）”毒品，将被处以至少五天的停学处罚；而首次“使用（表现出吸毒状态）”毒品，则是处以至少三天的停学处罚。"}
